,DATE,STAR,LIKE,REVIEW
4839,2018-11-15,별표 5개 만점에 5개를 받았습니다.,0,바코드 결제를 더 빠르게 할 수 있도록 개선 부탁드립니다
4840,2018-9-27,별표 5개 만점에 3개를 받았습니다.,0,오늘의퀴즈 문제 답안 작성시 오류가 너무 많습니다.
4841,2018-10-3,별표 5개 만점에 5개를 받았습니다.,0,매일매일 포인트도 쌓을 수 있고 좋아요~^^
4842,2018-9-28,별표 5개 만점에 4개를 받았습니다.,0,사용하기 편하고요 포인트적립까지되서 좋네요
4843,2018-10-10,별표 5개 만점에 5개를 받았습니다.,0,포인트 쌓고 전환하고 편하게 잘 쓰고있어요
4844,2020-4-16,별표 5개 만점에 5개를 받았습니다.,0,사용하기에 너무편하고 포인트도쌓이고 너무좋아요
4845,2018-11-29,별표 5개 만점에 5개를 받았습니다.,0,결제도 편하고 포인트리 사용도 쉬워요
4846,2018-9-30,별표 5개 만점에 5개를 받았습니다.,0,포인트 적립 사용이 편리합니다. 이벤트도 많아요
4847,2018-11-29,별표 5개 만점에 5개를 받았습니다.,0,리브메이트 앱 강력추천해요 쿠폰을 저렴하게 구매 가능하고 퀴즈이벤트로 포인트 적립도 되고 최고의 어플이네요
4848,2020-4-14,별표 5개 만점에 5개를 받았습니다.,0,다양한 이벤트와 포인트를 쌓을 수 있는 기회가 많아서 너무 좋아요
4849,2020-4-14,별표 5개 만점에 5개를 받았습니다.,0,사용하기 편하고 자주 사용해요 유용한 어플이예요
4850,2020-8-15,별표 5개 만점에 1개를 받았습니다.,1,접속하면 로딩에서 화면이 안넘어 가네요
4851,2020-10-5,별표 5개 만점에 4개를 받았습니다.,0,지금은 됐는데 변동이 바로바로 안되는건 간혹 있어왔어요
4852,2018-10-17,별표 5개 만점에 5개를 받았습니다.,0,너무잘사용하고있어요. 퀴즈로도 포인트리적립 잘하고있어용
4853,2018-11-12,별표 5개 만점에 4개를 받았습니다.,0,마음에 들어요 편하게 쓸수 있어서 좋아요 추천해요
4854,2021-3-19,별표 5개 만점에 5개를 받았습니다.,0,이벤트도 많고 편하게 이용해서 좋아요
4855,2018-9-20,별표 5개 만점에 5개를 받았습니다.,0,혜택이 다양하고 앱 사용이 편리해서 좋아요~
4856,2020-4-13,별표 5개 만점에 5개를 받았습니다.,0,"다양한 이벤트가 있고, 포인트관리하기에도 편해요"
4857,2020-4-13,별표 5개 만점에 5개를 받았습니다.,0,결재하기 편하고 유용한 정보가 많아요~~
4858,2018-9-30,별표 5개 만점에 5개를 받았습니다.,0,시간절약되고 유용한 정보
4859,2018-9-28,별표 5개 만점에 5개를 받았습니다.,0,사용하기편리하게 카테고리가 세분화되어있어서 좋아요
4860,2020-4-14,별표 5개 만점에 4개를 받았습니다.,0,너무 좋아요 편리하구요 ㅎㅎ 자주 이용합니다
4861,2018-11-15,별표 5개 만점에 1개를 받았습니다.,0,잘쓰고있습니다 오늘의퀴즈매일맞추는것도재미있어요
4862,2020-4-13,별표 5개 만점에 4개를 받았습니다.,0,포인트 많이 모을 수 있어서 유용해요.
4863,2019-11-25,별표 5개 만점에 4개를 받았습니다.,0,요즘 보고쌓기 퀴즈가 안뜨네요. 왜 그런가요
4864,2018-11-30,별표 5개 만점에 3개를 받았습니다.,0,포인트모으려고 이용하고 있어요 이벤트는 많지않아서 조금 아쉽네요
4865,2018-10-23,별표 5개 만점에 3개를 받았습니다.,0,이용자가 많지 않음에도 다소 느린거 같습니다
4866,2018-9-20,별표 5개 만점에 4개를 받았습니다.,0,이벤트나 사용에 색다르게 재미나게 구성되어있어 좋습니다.
4867,2020-4-13,별표 5개 만점에 5개를 받았습니다.,0,다양한 컨텐츠와 이벤트가 많아서 좋아요 ㅎㅎ
4868,2018-9-13,별표 5개 만점에 5개를 받았습니다.,0,굿 쓰기편하고 한눈에 볼수있어좋아요
4869,2019-7-27,별표 5개 만점에 5개를 받았습니다.,2,너무 좋아요-! 깔끔하고 은행 카드중에 괜찮은것 같아요
4870,2018-11-13,별표 5개 만점에 5개를 받았습니다.,0,포인트확인 및 현금화하기 좋습니다
4871,2020-4-16,별표 5개 만점에 5개를 받았습니다.,0,편리해요. 포인트 모으는 재미도 쏠쏠함
4872,2018-9-28,별표 5개 만점에 5개를 받았습니다.,0,포인트도 적립하고 유용한 정보들도 있고 재밌어용^^
4873,2018-9-20,별표 5개 만점에 3개를 받았습니다.,0,포인트가 얼만큼 모였는지 간편하게 확인할수 있어서 좋네요
4874,2021-3-19,별표 5개 만점에 4개를 받았습니다.,0,국민계열사 앱이 좀 많긴 하지만 그 중 이앱은 그럭저럭 사용할 만 해요
4875,2020-4-13,별표 5개 만점에 5개를 받았습니다.,0,유용한정보와 많은이벤트로 잘활용하고있어요 ~
4876,2018-9-25,별표 5개 만점에 5개를 받았습니다.,0,메뉴가 직관적이고 좋아요
4877,2020-4-16,별표 5개 만점에 4개를 받았습니다.,0,다른 어플 보다 포인트 쌓는 재미가 있네요 ㅎ
4878,2021-3-22,별표 5개 만점에 5개를 받았습니다.,0,좋습니다 만족해요
4879,2020-9-6,별표 5개 만점에 1개를 받았습니다.,0,지워도 아이콘 그대로 남아서 안없어지네요
4880,2020-4-13,별표 5개 만점에 5개를 받았습니다.,0,여러가지 이벤트에 정보까지 참 유용한 앱입니다 제 핸드폰 필수앱이네요
4881,2020-4-13,별표 5개 만점에 5개를 받았습니다.,1,X R N Q M 최고로 좋아요!!. ㅇ ㅓ ㅇㅇ플을 열심ㅎ ㅣ ㅣ 사용하고 있는 유조ㅁ ㅣ 다 몇 가지 요청하고 싶은게ㄱ ㅔ ㄱㄱㄱ 있는데 시청할 수 있는 광고를 만들어서 포인트를 주거나 ㄱ ㅔ ㅇ ㅁ미렛의 기회를 주었으면 합니다. 포인트를 많이 늘릴 ㄴㅇㅁㄴㅇ수 있는 놀이터의 업데이트도 되었으면 합니다. 이것말고는 아주 잘 쓰고 있는 유저입ㄴ ㅣ다. 수고하십시요~^^ ㄷ ㅐ ㅂ ㅏㄱ
4882,2020-8-26,별표 5개 만점에 3개를 받았습니다.,0,업데이트하니 전에 있던 포인트가 날아간 참담한 현실! 우째 이런 일이! 내 포인트 돌리도ㅜㅜ
4883,2018-11-26,별표 5개 만점에 5개를 받았습니다.,0,포인트를 다양한 방법으로 적립/활용 가능
4884,2018-11-29,별표 5개 만점에 5개를 받았습니다.,0,예전보다 앱 메뉴가 간단해져서 마음에 듬
4885,2018-10-23,별표 5개 만점에 4개를 받았습니다.,0,리브메이트 국민카드사용하면서득많이봤어요ㅎㅎ이벤트도많이해서포인트모으는재미도쏠쏠해요ㅎㅎ쿠폰더많이뿌려주세요ㅎ
4886,2020-4-14,별표 5개 만점에 4개를 받았습니다.,0,편리하고 저번에 환전도 이용했어요~~!
4887,2018-9-17,별표 5개 만점에 5개를 받았습니다.,0,간편하고 혜택이 많아서 좋아요
4888,2020-4-13,별표 5개 만점에 5개를 받았습니다.,0,이벤트도 있고 여러 편리한기능이 있어 좋아요
4889,2019-8-14,별표 5개 만점에 1개를 받았습니다.,0,에효 프로모션코드적는거있는지도 몰랐는데 좀더 눈에띄는곳에다가 두시지
4890,2020-4-15,별표 5개 만점에 5개를 받았습니다.,0,편하네요 포인트리적립 충전 기능 유용해요
4891,2018-9-28,별표 5개 만점에 3개를 받았습니다.,0,업뎃이후에 대기시간이 길어져서 별 2개 뺍니다.. 그외엔 만족합니다
4892,2018-9-29,별표 5개 만점에 5개를 받았습니다.,0,앱으로 소비패턴을 알 수 있고 커플 통장같은 기능이 유용해요
4893,2020-9-22,별표 5개 만점에 1개를 받았습니다.,0,포인트 보내려고 하면 계속 고객원장이 존재하지 않다고 뜨는데 어떻게 하나요
4894,2018-10-5,별표 5개 만점에 3개를 받았습니다.,0,묵혀만 두던 포인트리 조회하고 바코드로 사용할 수 있어 좋아요
4895,2020-4-13,별표 5개 만점에 5개를 받았습니다.,0,어플도 빠르고 아주 좋습니다
4896,2018-9-30,별표 5개 만점에 5개를 받았습니다.,0,포인트 전환 및 선물이 편해요
4897,2018-10-27,별표 5개 만점에 5개를 받았습니다.,0,이벤트와 금융이 모여 편리하고 유익해요
4898,2020-4-14,별표 5개 만점에 5개를 받았습니다.,0,UI가 보기 편하고. 앱 사용이 편합니다
4899,2020-4-14,별표 5개 만점에 5개를 받았습니다.,0,편하고 결제도 잘 되네요.
4900,2018-9-26,별표 5개 만점에 5개를 받았습니다.,0,다양한 포인트 이벤트가 있어서 좋아요 만족합니다 ♡
4901,2018-9-20,별표 5개 만점에 1개를 받았습니다.,0,네트워크가 원활하지 않다고만 뜨네요
4902,2020-4-15,별표 5개 만점에 5개를 받았습니다.,0,사용하기 편하고 이벤트도 다양해서 혜택도 마니마니 받을 수 있어요
4903,2018-11-30,별표 5개 만점에 5개를 받았습니다.,0,타카드 어플보다 구성이나 정보등이 많은것 같아 좋습니다.
4904,2020-4-15,별표 5개 만점에 5개를 받았습니다.,0,너무좋아요 역시 kb입니다 주거래은행으로 쓰는만큼 최고의앱
4905,2018-10-10,별표 5개 만점에 4개를 받았습니다.,0,아주좋아요! 훌륭한 리브메이트 말그대로 내 삶의 동반자같은 앱이에요!
4906,2020-4-13,별표 5개 만점에 5개를 받았습니다.,0,리브메이트 사용해봤는데 좋네요. 국민은행 사용자면 필수어플인거같아요
4907,2021-1-6,별표 5개 만점에 5개를 받았습니다.,0,처음에 나오는 리브메이트 소 넘나 귀여워요 ㅋㅋ 힘내소소~~~
4908,2018-11-17,별표 5개 만점에 5개를 받았습니다.,0,편리하고 간편한 최고의 어플!
4909,2021-3-1,별표 5개 만점에 1개를 받았습니다.,1,리브메이트앱에서 악성코드 맬웨어 탐지 되었다고 뜨는데 avast으로 검사했음 앱점검 해야할듯
4910,2020-7-27,별표 5개 만점에 1개를 받았습니다.,1,며칠째 접속이 너무 안된다. 관리자는 도대체 머하는지...별하나도 아깝다
4911,2018-10-10,별표 5개 만점에 4개를 받았습니다.,0,보다 편한 송금 전송 가능
4912,2018-9-28,별표 5개 만점에 5개를 받았습니다.,0,퀴즈이벤트도 좋고 편리하네요
4913,2018-9-20,별표 5개 만점에 5개를 받았습니다.,0,앱으로 포인트 관리도 되고 적립도 잘되고 좋네요
4914,2018-9-14,별표 5개 만점에 5개를 받았습니다.,0,좋아요 포인트리 확인도되고 적립도되고 좋네요
4915,2018-10-7,별표 5개 만점에 5개를 받았습니다.,0,매일 돈과 같은 금융포인트 받는 재미로 접속하게 됩니다
4916,2020-4-13,별표 5개 만점에 5개를 받았습니다.,0,리브메이트는 이벤트도 많아 적립 포인트도 쏠쏠하고 또돈보내기 등도 편해서 계속 쓰게 되는것같아요
4917,2020-4-14,별표 5개 만점에 5개를 받았습니다.,0,매일매일 소소하게 이벤트 참여하고 있습니다.더욱 많은 이벤트를 기대하겠습니다.
4918,2018-10-30,별표 5개 만점에 5개를 받았습니다.,4,업데이트 후 산뜻해지고 속도도 빨라졌네요.
4919,2018-11-26,별표 5개 만점에 4개를 받았습니다.,0,유아이 직관적이고 좋습니다
4920,2018-9-28,별표 5개 만점에 5개를 받았습니다.,0,리뉴얼이 더 잘되어서 보다 다양한 혜택 기대해봅니다.😄
4921,2020-7-31,별표 5개 만점에 4개를 받았습니다.,0,혜택은 좋은데 너무 느려요ㅜㅜ
4922,2018-10-14,별표 5개 만점에 5개를 받았습니다.,0,사용하기 편리하고 혜택도 좋아요
4923,2020-4-14,별표 5개 만점에 5개를 받았습니다.,0,오늘의 퀴즈 이거 은근중독성 있네요 상식도풀고 포인트도 쌓고 일석이조
4924,2020-4-14,별표 5개 만점에 5개를 받았습니다.,0,좋아요 항상 좋은앱과 즐거운 금융생활ㅎ
4925,2020-5-11,별표 5개 만점에 1개를 받았습니다.,1,데이터켰는데도 원활하지 않다고 뜨네요. 뭐야 이거..
4926,2018-11-18,별표 5개 만점에 5개를 받았습니다.,0,편하고 혜택보기도 좋네요
4927,2018-11-18,별표 5개 만점에 4개를 받았습니다.,0,한눈에관리하기편해요 만족합니다
4928,2018-11-30,별표 5개 만점에 5개를 받았습니다.,0,이벤트도 많고 혜택도 많아서 좋아요. 잘쓰고있어요
4929,2020-4-13,별표 5개 만점에 5개를 받았습니다.,0,가끔 재밋는 문제풀이해요
4930,2020-5-10,별표 5개 만점에 3개를 받았습니다.,0,앱은 좋은데 실행 할때마다 자주 섬은 화면만 뜨네요
4931,2018-10-4,별표 5개 만점에 5개를 받았습니다.,0,요즘 저의 최애 앱입니다~~ 아주좋아요 쿠폰받기도 좋고 핸드폰이용이재미있어요~~ 짱이예요
4932,2020-4-16,별표 5개 만점에 5개를 받았습니다.,0,써보니 해택도많고 편리하네요
4933,2021-3-20,별표 5개 만점에 4개를 받았습니다.,0,포인트 적립의 강자 리브메이트
4934,2018-10-1,별표 5개 만점에 4개를 받았습니다.,0,이벤트혜택이 좋네요 포인트리 바코드결제 잘쓰고 있습니다
4935,2020-5-7,별표 5개 만점에 2개를 받았습니다.,1,추천인을 입력하지 않았어요 입력후 다시 로그인하고 싶습니다
4936,2018-11-30,별표 5개 만점에 1개를 받았습니다.,0,업데이트 이후 결제대금 조회도 검색창도 없네요 불편하기 그지없네요
4937,2018-10-10,별표 5개 만점에 5개를 받았습니다.,0,포인트리를 현금으로 전환할 수 있는 좋은 앱입니다. 국민카드 쓰신다면 추천해요
4938,2018-11-17,별표 5개 만점에 4개를 받았습니다.,0,심장 쫄깃하게해주는 리메....진짜 자주 들어갈수밖에 없네요
4939,2020-4-13,별표 5개 만점에 5개를 받았습니다.,0,퀴즈도 많고 아주 좋은어플이에요!!
4940,2018-10-8,별표 5개 만점에 4개를 받았습니다.,0,이벤트도 많고 로그인도 간편하고 좋아요
4941,2018-11-30,별표 5개 만점에 5개를 받았습니다.,0,리브메이트 넘 좋아요 오늘의 퀴즈 넘 재밌고 포인트 모으는 재미가 있어요^^
4942,2018-9-21,별표 5개 만점에 4개를 받았습니다.,0,포인트를 간간히 모을 수 있어서 좋네요. 많은 이벤트 기대합니다.
4943,2020-4-14,별표 5개 만점에 4개를 받았습니다.,0,"kb국민카드,앱카드,리브메이트 너무 많아요. 한개로 통합 앱 있었으면 좋겠습니더."
4944,2018-9-21,별표 5개 만점에 5개를 받았습니다.,0,매일 접속해서 이벤트 및 포인트리 이용하고있어요 좋아요
4945,2018-10-4,별표 5개 만점에 3개를 받았습니다.,0,핫딜시간만 기다리다가 아무일도 못하는거빼고는 유용합니다
4946,2020-4-13,별표 5개 만점에 5개를 받았습니다.,0,리브메이트 편리합니다. 포인트쌓기도 좋아연
4947,2018-11-25,별표 5개 만점에 5개를 받았습니다.,0,다양한 혜택과 이벤트 포인트리적립까지 정말 좋아요
4948,2020-4-27,별표 5개 만점에 4개를 받았습니다.,0,리브메이트 어플 자주쓰는데 이벤트도 많은데 서버가 터질때가 많아서 불편해요
4949,2020-4-13,별표 5개 만점에 5개를 받았습니다.,0,포인트 쌓기도 있고 가끔 이벤트도 좋네요.
4950,2018-11-15,별표 5개 만점에 5개를 받았습니다.,0,포인트 적립할 수 있는 이벤트가 많이 생겼으면 좋겠어요^^
4951,2020-4-14,별표 5개 만점에 2개를 받았습니다.,0,사용자많을시 접속이 너무 오래걸려 불편
4952,2020-12-10,별표 5개 만점에 5개를 받았습니다.,0,2020년12월10일 설치 카카오페이지에서 보고 설했어요
4953,2020-8-9,별표 5개 만점에 1개를 받았습니다.,0,이게 앱이냐 숫자입력해도 숫자입력하라고 팝업뜨고 내 고등학교 후배한테 만들라고해도 이렇게 안만들겠다
4954,2018-10-26,별표 5개 만점에 5개를 받았습니다.,0,Kb금융의 모든 정보를 쉽게 볼수있어서 좋아요
4955,2020-4-14,별표 5개 만점에 5개를 받았습니다.,0,퀴즈로 소액이지만 적립되고 많은 쿠폰을 얻을수 있어요 좋습니다
4956,2019-9-16,별표 5개 만점에 1개를 받았습니다.,1,업데이트 하라면서 거의 24시간해놨는데 계속 대기중만 뜨고....
4957,2020-4-13,별표 5개 만점에 5개를 받았습니다.,0,생각보다 포인트도 잘쌓이고 유용하개 잘쓰고있습니다
4958,2020-7-22,별표 5개 만점에 5개를 받았습니다.,0,앱카드 잘사용하고 퀴즈 잘 풀고 있습니다.
4959,2018-11-30,별표 5개 만점에 5개를 받았습니다.,0,매달 다양한 핫딜 이벤트도 마음에 들고 그 외 이벤트가 많아서 아주 만족스러워요!
4960,2020-4-14,별표 5개 만점에 5개를 받았습니다.,0,속조는 느리지만 쓸만해요
4961,2018-9-14,별표 5개 만점에 4개를 받았습니다.,0,다양한 구성과 전적으로 편한
4962,2018-9-23,별표 5개 만점에 5개를 받았습니다.,0,혜택이 많고 사용하기 좋아요
4963,2018-10-14,별표 5개 만점에 4개를 받았습니다.,0,리브메이트 앱을 통해 포인트도 받고 정보도 얻고 편리하네요
4964,2018-10-31,별표 5개 만점에 5개를 받았습니다.,0,나름 유용하게 많더라고요. 잘 쓰고있습니다ㅋㅋ
4965,2019-1-17,별표 5개 만점에 1개를 받았습니다.,9,컬쳐랜드 이벤트로 첫 회원가입하고 추천인 코드란에 컬쳐랜드 쓰면 2000원 준다길래 했더니 코드 입력하려던참에 잠시 홈버튼 눌렀다 다시 들어갔더니 추천인란 사라지고 바로 메인화면 뜨네요 뭐에요 진짜...ㅠㅠ 원래 홈버튼 누르면 다 나가지는건가요? 메인화면에도 추천인 입력하는거 사라지고 탈퇴하고 다시 회원가입해도 없네요 억울합니다 ㅠㅜ 다른 어플들은 홈버튼 눌러도 잘만 되던데 왜 이어플이랑 컬쳐랜드는 ...
4966,2018-9-14,별표 5개 만점에 5개를 받았습니다.,0,리브메이트로 절약하며 잘 소비하고있네요 감사합니다.
4967,2018-9-21,별표 5개 만점에 5개를 받았습니다.,0,어플 처음 나왔을 때부터 잘 사용하고 있어요~^^ 만족스러워요!
4968,2018-11-26,별표 5개 만점에 4개를 받았습니다.,0,KB통합멤버쉽 리브메이트 사용하기 편하고 좋아요~
4969,2018-11-15,별표 5개 만점에 4개를 받았습니다.,0,포인트적립 등 다양한혜택이 많아서 좋아요
4970,2018-9-17,별표 5개 만점에 4개를 받았습니다.,0,여러가지 이벤트로 포인트리도 받고 관리 및 사용도 할수있어서 너무 좋아요
4971,2020-4-13,별표 5개 만점에 5개를 받았습니다.,0,문화상품권 저렴에 구매할 수 도 있구요 생각보다 어플 구동이 빠릅니다
4972,2020-4-14,별표 5개 만점에 5개를 받았습니다.,0,편의기능도 많고 혜택도 많아요
4973,2018-9-30,별표 5개 만점에 3개를 받았습니다.,0,포인트를 틈틈히 쌓을 수 있어서 좋네요
4974,2019-12-20,별표 5개 만점에 1개를 받았습니다.,2,최악이네. 회원가입시 인증번호 입력란이 활성화가 안됩니다.
4975,2020-4-13,별표 5개 만점에 5개를 받았습니다.,0,여러 퀴즈와 쿠폰서비스 좋아용.
4976,2020-4-14,별표 5개 만점에 5개를 받았습니다.,0,편하다. 애러가 없다. 빠르다. 잘 만든 어플!
4977,2020-4-14,별표 5개 만점에 5개를 받았습니다.,0,편리하고 유용합니당
4978,2020-4-16,별표 5개 만점에 5개를 받았습니다.,0,좋아요 만족합니다 괜찮은어플이에요ㅎㅎ
4979,2020-4-16,별표 5개 만점에 5개를 받았습니다.,0,혜택도 많고 좋네요. 강추입니다!!
4980,2020-4-15,별표 5개 만점에 5개를 받았습니다.,0,매일 퀴즈로 포인트 잘 받고 있어요~
4981,2020-4-14,별표 5개 만점에 4개를 받았습니다.,0,이벤트.핫딜이 많아 편함. KB은행 계좌충전이 쉬움
4982,2020-4-13,별표 5개 만점에 4개를 받았습니다.,0,앱은 좋은데 간편결제 적립이벤트 사라져서 너무 아쉬움
4983,2018-9-21,별표 5개 만점에 4개를 받았습니다.,0,처음보다 많이 개선되어 사용하기 편리해졌네요
4984,2020-4-15,별표 5개 만점에 5개를 받았습니다.,0,사용하기 편하고 여러 이벤트들로 잘 쓰고 있어요
4985,2020-8-2,별표 5개 만점에 1개를 받았습니다.,1,이건 뭐 설치하고 앱이 열리지가 않네 S8+ 인데 왜이런걸까요 ㅡㅡ
4986,2018-11-19,별표 5개 만점에 5개를 받았습니다.,1,앱은 좋은데 귀찮아서 리뷰같은거 안했는디 이벤트까지 해주넹? ㅎㅎ
4987,2018-10-14,별표 5개 만점에 5개를 받았습니다.,0,진짜좋아요 편리하고 매일사용하고있어요^^
4988,2020-10-11,별표 5개 만점에 2개를 받았습니다.,0,이거 컬쳐랜드 때문에 다운 받았는데 추천정보 등록이 싹다 kb 인데 켤쳐랜드를 어케쳐요? 다 숫자로 쓰라는데(가입오늘함)
4989,2020-4-14,별표 5개 만점에 4개를 받았습니다.,0,조금 느릴때도 있지만 만족합니다.
4990,2018-9-14,별표 5개 만점에 5개를 받았습니다.,0,몇번 사용해보면 어렵지않게 사용할 수 있어요
4991,2018-10-8,별표 5개 만점에 4개를 받았습니다.,0,아직 익숙치가 않아서 유용성을 못느끼지만 자꾸 쓰면 괜찮을거 같애영
4992,2020-11-2,별표 5개 만점에 1개를 받았습니다.,0,최악의 어플 리브랑 리브메이트 통합을 하던지
4993,2018-9-30,별표 5개 만점에 5개를 받았습니다.,0,리브메이트 잘 사용하고 있습니다. 퀴즈 푸는 것으러 포인트 쌓는 게 꿀임
4994,2018-9-17,별표 5개 만점에 5개를 받았습니다.,0,일상생활에 꿀재테크를하면서 도움받고있습니다~추천해요
4995,2020-4-14,별표 5개 만점에 4개를 받았습니다.,0,Ui도 잘되어잇고 편합니다
4996,2019-11-6,별표 5개 만점에 5개를 받았습니다.,2,유용하게 잘 사용하고 있어요 포인트도 쌓이고 상식도 늘어갑니다
4997,2020-4-14,별표 5개 만점에 5개를 받았습니다.,0,직관적이고 사용하기 편해요
4998,2020-4-13,별표 5개 만점에 5개를 받았습니다.,0,여러 이벤트도 좋고 사용하기 편해여~
4999,2018-9-30,별표 5개 만점에 4개를 받았습니다.,0,잘 사용하고 있습니다. 기능이 많은건 좋은데 조금만 가벼워지면 좋겠네요.
5000,2018-11-30,별표 5개 만점에 4개를 받았습니다.,0,가끔 너무 느려서 렉이 먹어요 ㅋㅋ
5001,2018-10-22,별표 5개 만점에 4개를 받았습니다.,0,퀴즈도 풀수 있고 포인트리도 받을수 있어서 좋음
5002,2020-4-15,별표 5개 만점에 5개를 받았습니다.,0,앱테크 및 각종이벤트 참여 완전 좋아요
5003,2018-11-14,별표 5개 만점에 4개를 받았습니다.,0,포인트전환도 잘되고 좋네요
5004,2020-4-14,별표 5개 만점에 5개를 받았습니다.,0,상당히 편리하고 좋습니다 추추추추천천천천
5005,2018-9-13,별표 5개 만점에 5개를 받았습니다.,0,굿 연동속도가 좀 더 빨랐으면!!! 최적화 8282
5006,2018-11-15,별표 5개 만점에 5개를 받았습니다.,0,이벤트도 다양하고 편리해서 잘 이용하고 있어요
5007,2018-9-21,별표 5개 만점에 4개를 받았습니다.,0,자주애용하고있어요 포인트전환시 굿굿ㅋㅋ
5008,2020-4-14,별표 5개 만점에 5개를 받았습니다.,0,쉽고 간편해서 자주 사용합니다
5009,2020-4-15,별표 5개 만점에 5개를 받았습니다.,0,진짜 사용하는데 넘 좋고 편해요
5010,2018-10-27,별표 5개 만점에 5개를 받았습니다.,0,이벤트로 기프티콘을 살수있어요 편의점에서 앱카드사용으로 10%할인 받아요
5011,2020-4-14,별표 5개 만점에 4개를 받았습니다.,0,국민은행 계좌가 있다면 편리하게 포인트를 주고받을수 있어서 좋습니다
5012,2021-3-24,별표 5개 만점에 5개를 받았습니다.,0,포인트 적립 짱이에요
5013,2020-4-13,별표 5개 만점에 5개를 받았습니다.,0,정말 좋아요. 포인트 관리하기도 사용하기도 너무 좋습니다
5014,2020-8-19,별표 5개 만점에 1개를 받았습니다.,1,앱 실행이 안 되는 경우가 더 많음. 사용하지도 못할거 왜 만들었을까
5015,2018-9-12,별표 5개 만점에 4개를 받았습니다.,0,매일 아침 퀴즈 푸는 재미가 솔솔해요~
5016,2020-4-14,별표 5개 만점에 5개를 받았습니다.,0,"이벤트도 많이 있고, 포인트 관리하기도 좋고, 좋네요~~"
5017,2020-4-13,별표 5개 만점에 5개를 받았습니다.,0,다양한 이벤트 행사로 매일 사용하게 되네요.^^
5018,2020-4-14,별표 5개 만점에 5개를 받았습니다.,0,다양한 이벤트와 기능들이 있어서 좋아요.
5019,2018-10-15,별표 5개 만점에 4개를 받았습니다.,0,포인트 조회/쌓기 활용할 때 너무 유용해요
5020,2018-10-10,별표 5개 만점에 5개를 받았습니다.,0,여러가지 가계경제에 도움이 되는 앱이라 좋습니다
5021,2020-4-13,별표 5개 만점에 5개를 받았습니다.,0,포인트 모으기도 너무 좋고 아주 유용한 앱입니다.
5022,2019-6-27,별표 5개 만점에 5개를 받았습니다.,1,상식도 쌓을수가 있고 머니도 쏠쏠한 재미를 주는 것 같아요
5023,2020-4-14,별표 5개 만점에 5개를 받았습니다.,0,리브메이트 타임딜이 정말 좋아요 대박 1년정도 사용햇어요 ㅎㅎ 앞으로도 좋은 혜택 부탁드려요
