,DATE,STAR,LIKE,REVIEW
2227,2018-9-28,별표 5개 만점에 3개를 받았습니다.,0,디자인 및 반응속도는 타 회사 대비 빠릅니다. 다만 각 회사별로 깔아야하는 어플들이 너무 많은데 오히려 단순화하여 하나의 어플로 통합 해주는 회사가 있으면 좋겠습니다 ㅠㅠ
2228,2018-9-22,별표 5개 만점에 5개를 받았습니다.,0,포인트도 모을수 있고 핫딜로 저렴하게 쿠폰도 살수있고 퀴즈도 재미있어서 앱이용을 자주 해요~~ 오류나는것만 잘 개선해주면 정말 좋은 앱이 될것 같아요~~
2229,2018-9-17,별표 5개 만점에 4개를 받았습니다.,0,느린점 빼고는 다 좋아여. 일반결제를 위해 접속할때 이벤트를 위해서 접속하는사람들이랑 겹쳐서 대기시간 뜰때가 잇습니다. 이거 분리하면 더 사용하기 편할거같네여
2230,2018-10-5,별표 5개 만점에 3개를 받았습니다.,0,가끔씩 이벤트가 있거나하면 문자가와서 접속을 하는 경우가 있는데 매번 그럴때마다 접속 시간이 다른 앱에 비해 상당히 걸리는편이다. 시정됬으면한다.
2231,2020-4-13,별표 5개 만점에 5개를 받았습니다.,1,"매일,매주 퀴즈로 포인트 적립되고 이벤트도 많아서 매일 접속합니다 4월부터 바코드결재가 없어 그게 제일 아쉬워요~ 앱자체는 쓰기 편하고 좋아요~"
2232,2018-11-30,별표 5개 만점에 4개를 받았습니다.,0,처음 실행할때 앱이 무거운 느낌이고 들어가자마자 직관적인 메뉴가 별로 없어서 전체펼침으로 봐서 들어가요 바로가는 메뉴를 깔끔하게 정리할 필요가 있다고 생각합니다
2233,2018-11-20,별표 5개 만점에 4개를 받았습니다.,0,이벤트도 쿠폰도 이용하기 좋은 어플. 최근 업뎃이후 약간 산만해진 경향이 있어 접근성이 조금 어려워진것같음. 쓰다보면 또 적응이되서 잘쓸것같아요
2234,2018-10-30,별표 5개 만점에 5개를 받았습니다.,7,다양한 기능이 있지만 늘 사용하는 기능만 이용하게 되어 조금 아쉬워요~ 여러 앱은 하나로 만들면 더 좋을것 같아요. 여러개의 앱을 깔아야 해서 조금 불편함은 있어요
2235,2020-5-16,별표 5개 만점에 3개를 받았습니다.,2,"리브메이트는 왜 긴급재난지원금 신청시에 따로 문자알림 안오고 리브메이트에서만 확인해야하고, 지원금 사용시에도 문자알림 안오고 리브메이트에서 일일이 확인해야하고..다른데는 문자알림 오던데..왜 그런거죠? 저만 그런건가요..;"
2236,2018-9-13,별표 5개 만점에 5개를 받았습니다.,0,이벤트도 많이하고 쿠폰도 저렴히 구입하고 바코드 결제시 10% 캐쉬백도 되고 너무 우용한 앱이에요. 관리자분도 궁금한게 있어서 연락한적 있는데 너무 친절하게 설명해주셨어요. 앞으로도 재미있고 유익한 이벤트 많이 해주세요~
2237,2021-3-21,별표 5개 만점에 4개를 받았습니다.,0,이벤트 많아서 좋음
2238,2018-9-17,별표 5개 만점에 5개를 받았습니다.,0,편리하고 유용한 앱이라 좋아요 조금 시간 투자하면 포인트도 모을수있고 이벤트 참여도 다양하고 퀴즈 이벤트로 상식도 넓어지고 있어요 아마도 금융앱중에 제일 으뜸인거 같네요
2239,2018-10-17,별표 5개 만점에 4개를 받았습니다.,0,포인트리를 적립할 수 있는 소소한 이벤트나 재미있는 기능들이 많은 건 좋은데 좀 더 실용적인 기능도 추가되었으면 합니다. 예를 들면 리브의 일부 기능을 사용할 수 있다든지요.
2240,2018-11-30,별표 5개 만점에 4개를 받았습니다.,0,예전보다 나아진것 같긴 한데 아직 느려요. 그리고 사용 동선이 한눈에 들어오지 않습니다. 기능은 많은데 그 기능이 한눈에 들어오지 않아 이런게 있었어 싶을때가 많아요.
2241,2018-10-5,별표 5개 만점에 4개를 받았습니다.,0,갑자기 잘되던 로또리치가 클릭하면 왜 화면이 번호받기로 살짝 넘어가다가 다시 홈으로 돌아가나요? 이거 오류인가요? 아님 제 핸드폰이 이상한건가요?ㅡㅡ
2242,2019-1-20,별표 5개 만점에 1개를 받았습니다.,0,프로모션 코드에 컬쳐랜드를 입력했는데 앱이 꺼져서 다시 키니 회원가입이 끝나있고 쿠폰은 도착을 안했습니다. 재가입을 시도해도 프로모션 코드 입력이 사라져있습니다.
2243,2018-11-30,별표 5개 만점에 4개를 받았습니다.,1,잘쓰고 있습니다. 이벤트도 많고 포인트리도 보기쉽고요!! 더많은 이벤트와 혜택으로 반겨주면 좋겠습니다 더 큰 발전을 기대합니다
2244,2020-4-15,별표 5개 만점에 4개를 받았습니다.,0,"다양한 금융상품 소개, 할인되는 기프티콘, 결제까지 다양하게 사용할수 있어 좋습니다 단지 kb에서 내놓은 어플이 너무 많아 공통된 내용은 묶어 어플갯수를 줄이는것이 좋을것 같다는 생각을 해봅니다"
2245,2021-3-9,별표 5개 만점에 5개를 받았습니다.,0,리브메이트 자산연동 정말 좋은금융서비스 입니다 나의자산이 얼마인지 한 눈에 손쉽게 알수 있으니까요
2246,2020-4-15,별표 5개 만점에 4개를 받았습니다.,0,다양한 혜택이 있어 잘 사용하고 있어요. 클럽 혜택은 익숙하지 않아서 인지 복잡하게 느껴지네요. 좀 더 직관적이고 단순한 구조면 더욱 좋은 어플이 될 것 같습니다.
2247,2020-4-14,별표 5개 만점에 5개를 받았습니다.,0,일단 카드사에서 제공하는 어플 중 가장 기본이 잘 되어 있는것 같습니다.실적관리라던지 혜택 등등을 굳이 검색하고 찾아보지 않아도 쉽게 찾아 볼 수 있어요. 이벤트도 혜택도 정말 많구요. 짱 좋음.
2248,2018-9-18,별표 5개 만점에 5개를 받았습니다.,0,아주 잘 쓰고 있어요! 포인트 모으는 재미도 있고 국민은행이라는 브랜드에 더 친근한 느낌이 들도록 해주는 앱인 거 같아요 :)
2249,2018-9-23,별표 5개 만점에 4개를 받았습니다.,0,친구추천으로 깔았는데 포인트도 다른 앱에 비해 많이 깔리고 좋은거같아요^^ 별한개 뺀건 핫딜구매할때 자꾸 튕겨서 불편한점이 있고~요몇일 오류가 자주 나는건 개선해주시면 좋겠어요~
2250,2018-10-7,별표 5개 만점에 4개를 받았습니다.,0,생각보다 소소한 이벤트도 많고 포인트 확인도 쉽게 할 수 있어 좋습니다. 가끔 접속이 느릴때가 있는데 이것만 개선된다면 더 편리하게 사용할 수 있을것 같아요.
2251,2019-10-12,별표 5개 만점에 1개를 받았습니다.,4,인증번호가 안와요.몇번을 다시 해보고 잘못 쓴거 있나 확인해봐도 안와요...그렇다고 전화번호 지우고 다시쓰는건 애초에 고정이라서 못하게 되있는것 같은데...그냥 안되네요...왜죠?
2252,2018-11-2,별표 5개 만점에 2개를 받았습니다.,1,저만 그러는지 몰라도 처음에 동의 다 받고 회원가입창으로 넘어가야되는거같은데 저는 '라이브에 포인트를 찍다'라는 화면이 계속 유지가 되서 회원가입도 못하고있어요. 빠른답 부탁드립니다.
2253,2020-11-20,별표 5개 만점에 4개를 받았습니다.,0,처음이라 잘모르겟고 이제부터 해보려고요
2254,2020-9-25,별표 5개 만점에 2개를 받았습니다.,2,"오늘 설치했는데 한달전에 설치가 되어있다하고, 다시 설치했으니 이전기록이 없어 확인이 안된다 상담받았습니다. 또한 이상한점은 통신사에 문의하라해 통신사에 문의하니 통신사에서는 자신과 무관하다 하더군요. 이전에 설치가 되었다면 본인인증등 문자조차 없이 명의가 도용되었슨데 그 회사에서는 아무 책임도없으며, 찾을수도 없다는 황당한 주장만을 하고 있습니다. 어디 불안해서 설치할수 있겠어요??"
2255,2018-9-18,별표 5개 만점에 3개를 받았습니다.,0,국민은행 및 카드 유저 라서 다운 받아 사용했는데 포인트리를 간편하게 확인 사용할 수 있어 편하지만 간편 송금과 같은 기능은 한정적이라 한계가 있어 보입니다.
2256,2018-10-7,별표 5개 만점에 5개를 받았습니다.,0,"매일매일 퀴즈 참여 및 시사경제문제 풀이 등을 통해 포인트리를 모을 수 있어서 무척 요긴하고, 쓸모있는 쿠폰도 받아 사용할 수 있어 좋은 것 같아요~"
2257,2018-9-15,별표 5개 만점에 4개를 받았습니다.,0,혜택도 많고 포인트도 쌓을 수 있어서 좋아요~ 간혹 접속오류가 날 때도 있지만 이 부분만 빼면 넘 좋은 앱인 것 같아요 거의 매일 이용하는 어플이라는~
2258,2019-1-27,별표 5개 만점에 1개를 받았습니다.,0,로그인 하라면서 로그인을 왜 못하게함? 다른분들은 로그인이 돼셨어요? 아니 사람차별하나.. 지웠다 설치했다 반복해도 안됨 인증번호가 아에 않오잖아
2259,2020-8-2,별표 5개 만점에 1개를 받았습니다.,2,아니 서비스 접속니 원활하지 않은것도 정도껏이지 장난하나 싶네요. 내가 10원받자고 이걸 붙들고 30분이상을 있어야 하나..? 업데이트 하고는 이래요. 아무래도 쓰지말라는 무언의 압박인가 싶네요
2260,2021-3-20,별표 5개 만점에 5개를 받았습니다.,0,국민 포인트리 쏠쏠하게 잘 모여요~~ 다만 자산연동이 아직 잘 안되는 것 같네요
2261,2019-3-31,별표 5개 만점에 1개를 받았습니다.,2,접속이 안돼넹... 업데이트후에 먹통 지웠다 깔아도 안됌... 버그 수정이나 좀 해주시길... 고객센터 전화하면 답이 나오는것도아닌데.. 그놈의 고객센터는... 수정이나 언능 해주시길...
2262,2018-9-28,별표 5개 만점에 4개를 받았습니다.,0,맨날 출첵합니다. 포인트 모으는 재미는 있는데..메뉴들이 새로 생겨나고 있다는건 보이는데 다른 메뉴는 눈팅만 할뿐..별로 사용하지 않게 되네요
2263,2018-9-16,별표 5개 만점에 2개를 받았습니다.,0,솔직히 이 앱은 실용적이지 않고 활용도가 떨어집니다. 이용방법도 제 기준에선 복잡해서 이용거의 안하게 되네요. 개선해서 간편하고 좀 더 많은혜택이 주어진다면 앱 활성화가 될것같네요
2264,2018-9-22,별표 5개 만점에 4개를 받았습니다.,0,국민카드를 주카드로 이용하고 있는데요 여러모로 편리하고 좋네요 포인트 확인도 가능하고 이벤트도 많고 앞전엔 생전 안되던 이벤트당첨까지 편리하고 카드앱중에선 최고입니당!!!
2265,2020-9-8,별표 5개 만점에 1개를 받았습니다.,0,설치가 안되네요. 캐쉬 지우고 데이터 삭제해도 다운후 설치과정에서 실패해요. 롤리팝에 갤4인데 이번 업데이트는 최악이네요.
2266,2018-11-1,별표 5개 만점에 1개를 받았습니다.,1,네트워크 문제 메세지 뜨고 먹통되는거 이거 업데이트하고 adguard와 충돌합니다. 빨리 해결 좀 ㅡㅡ 임시해결방안은 adguard 설정 앱관리에서 이거 찾고 https 필터링 체크 풀어야함.
2267,2021-3-20,별표 5개 만점에 5개를 받았습니다.,0,이벤트 많아 포인트 잘 모을수 있고 사용하기 편해요
2268,2019-11-28,별표 5개 만점에 1개를 받았습니다.,1,별한개도 아까운 개구데기 서버관리에 들어갈때마다 역겹네요 ㅎㅎ 이럴거면 이벤트는 왜하는지 대가리에 든게 없는건지 의문이 드네요 그따구로 할거면 앱 자체를 아예 만들지 않기를 간절히 부탁드립니다^^
2269,2020-4-13,별표 5개 만점에 4개를 받았습니다.,0,포인트리 적립 충전 등 유용한 앱이나 바이오인증 로그인도 안되는데다가 다른앱 내용 보고 입력해야하는데 화면 전환시 바로 앱이 꺼져 버려서 무한 비번 입력 로그인 해야하는게 너무 불편합니다.. 그것만 개선해주시면 아주 잘 쓸 수 있을 것 같아요
2270,2018-11-30,별표 5개 만점에 4개를 받았습니다.,0,주로 포인트리 관리용으로 사용중이에요~ 주로 사용하는 메뉴는 한정적이라그런지 좀 복잡한느낌이 들기도해요 자주사용하다보면 익숙해지지않을까해요
2271,2018-9-22,별표 5개 만점에 5개를 받았습니다.,0,이벤트도 알차고 메이트쿠폰이나 퀴즈등등 혜택이 많아서 포인트 쏠쏠하게 잘모으고있습니다 포인트말고도 바코드 결제나 여러 기능이 많아서 유용한어플입니다 앞으로도 좋은기능 이벤트 업뎃바랍니다~
2272,2020-4-13,별표 5개 만점에 3개를 받았습니다.,0,리브가 간결하게 핵심기능만 뽑아둔 반면(그나마도 홍보가 안되서 사용하가...) 리브메이트는 기능은 믾으나 이 앱이 무엇을 말하고 싶은건지 정체성이 불분명해보임
2273,2020-4-13,별표 5개 만점에 5개를 받았습니다.,0,포인트리 모을까하고 설치했는데 매우 유용하게 사용 중입니다. 다양한 이벤트도 진행하고 금융정보도 알차게 제공해서 매우 만족하며 사용하고 있습니다.
2274,2018-11-18,별표 5개 만점에 5개를 받았습니다.,0,"다양한 기능을 사용할 수 있어서 좋은데, 업데이트 후 어려워진 느낌이 있어요~~ 이벤트등 포인트리 이용하는 법도 유용하고 좋아요!!"
2275,2020-4-15,별표 5개 만점에 5개를 받았습니다.,0,포인트도.바로바로~쌓이고동시에 현금으로 내계좌로 옮길수도 바코트 쇼핑도 할수잇고 카드사용할수록 재미가 쏠쏠 ~ 알뜰하게 카드사용에 리브메이트 적립까지~~~👍🤗 감사합니다.^^~^^
2276,2018-11-2,별표 5개 만점에 3개를 받았습니다.,2,업데이트 이후 바코드 결제창이 잘 안떠서 계산대에서 한없이 기다려야해요 5분은 걸리는듯 왜 이런건가요??? 특정 가맹점 문제인줄알았는데 좀전에 또 그래서 어제날짜로 결제되어야하는거 날짜 넘겼네요
2277,2021-3-21,별표 5개 만점에 5개를 받았습니다.,0,쏠쏠해요~
2278,2019-5-13,별표 5개 만점에 1개를 받았습니다.,1,"애플리케이션 '앱 권한' 좀 줄이시죠. sms, 저장공간, 주소록, 카메라를 왜 필수로 해놓은 겁니까? 전화만 필수로 해놔도 사용하는데 아무 지장 없는 시스템인데 그렇게 제 사생활이 궁금한 겁니까? sms나 주소록 등은 필요할 때 선택해서 쓰면 되고 저장공간은 다 서버에 저장될텐데 뭐한다고 권한을 가져가는지. 그리고 카메라 역시 저 같은 경우는 이걸로 아예 결제하지도 않는데 ... 필수권한 좀 최소한으로 합시다."
2279,2020-4-14,별표 5개 만점에 4개를 받았습니다.,0,앱 반응속도가 빠르고 각종 이벤트가 열려서 좋아요 그런데 재로그인 시 굳이 개인정보를 다시 입력하지않아도 재로인할 수 있게 해주시면 더 편리할것 같아요
2280,2018-9-30,별표 5개 만점에 4개를 받았습니다.,0,포인트리를 좀 더 여러방면으로 활용할 수 있어 좋아요. 오프라인 가맹점도 더 많이 늘어났음 좋겠고 포인트리 전환가맹점도 더 다양해졌음 좋겠어요.
2281,2020-10-14,별표 5개 만점에 2개를 받았습니다.,0,보안키패드가 안떠서 숫자를 입력못하네요. 빠른 수정 부탁드려요
2282,2020-4-16,별표 5개 만점에 5개를 받았습니다.,0,"카드 사용 관련으로만 이용하는 앱이 아니라 퀴즈 참여 이벤트, 쿠폰 구매 등 다양하게 즐길 수 있어 좋아요. 즐기고 얻는 포인트리는 덤."
2283,2020-4-15,별표 5개 만점에 5개를 받았습니다.,0,계속 개선하고 있는거 같아 좋아요. 그래도 자주가는 메뉴는 따로 관리하는 방식이 있었음해요. 같은곳을 여러번 해야하는 번거로움이 살짝 들어요
2284,2018-10-16,별표 5개 만점에 4개를 받았습니다.,0,다양한 혜택과 포인트적립 할수있는 방법이 많아서 자주 이용하게되는거같아요~~!!더욱더 새로운방법으로 혜택들이 많았으면 더 좋을꺼같아요ㅎㅎ
2285,2019-7-3,별표 5개 만점에 2개를 받았습니다.,0,저기 오늘 신체검사받고 이앱을 깔았는데요.. 병무청에서 포인트 나 불고기세트 쿠폰 준다고해서 깔고 회원가입까지 한상태에서 보니까 회원가입할때 기입해야되는거더라구요... 이거 가입한상태에서는 기입할수없는건가요..?
2286,2018-9-14,별표 5개 만점에 5개를 받았습니다.,0,정말 정말 잘 사용하고 있는 은행중에 하나입니다. 다양한 이벵도 진행되고 정신놓을 틈이 없어요 마음에 드는 앱이에요!!
2287,2018-9-26,별표 5개 만점에 5개를 받았습니다.,1,KB 체크카드와 함께 연계하여 잘 이용하고 있습니다. 단지 자정직후 사용시 사용자가 한꺼번에 몰려서 대기시간이 너무 깁니다. 업그레이드를 요청드립니다.
2288,2020-4-13,별표 5개 만점에 5개를 받았습니다.,0,"리브메이트 잘 사용하고 있어요. 결제혜택, 각종 이벤트까지 여러모로 혜택이 좋아요. 사용하기 쉽게 되어있고 결제하기도 넘 편해요~"
2289,2020-10-18,별표 5개 만점에 1개를 받았습니다.,0,지문 로그인이 안됩니다. 로그인 방식을 변경 할 수 있도록 하는 기능이 없나요?
2290,2018-10-28,별표 5개 만점에 5개를 받았습니다.,0,포인트 적립이 많이 돼서 가입했는데 지금은 줄어서 아쉬워요. 그치만 커피 등 소소한 간식거리 포인트로 저렴하게 구할 수 있어서 좋네요.
2291,2018-9-27,별표 5개 만점에 3개를 받았습니다.,0,처음에 계속 튕겨서 놀랐어요. 안정성은 확실히 더 개선되어야 할 필요가 있는것 같습니다. 하루에 한번씩 할 수 있는 오늘의 퀴즈는 좋아요.
2292,2018-11-30,별표 5개 만점에 4개를 받았습니다.,0,평소에 정말 앱을 잘쓰고있는 유저입니다. 그런데 갑자기 통신오류가 떳다면서 앱에 로그인이 안되고 결제가 안되는데 오류 좀 없애주세요
2293,2018-10-2,별표 5개 만점에 5개를 받았습니다.,0,사용하기좋은 리브메이트 KB의 통합 멤머십 플랫폼으로서 모두가 다아는 아주 좋은 어플입니다. 사용하기 간단하고 좋은 혜택도 많아서 자주 사용합니다 감사합니다 만들어주셔서
2294,2018-9-16,별표 5개 만점에 5개를 받았습니다.,0,전체적으로 메뉴구성이 깔끔하고 이용하기 편리하나 로그인안하고 개별 메뉴로 들어가면 다시 초기화면으로 들어가야 하는 번거로움이 있네요.
2295,2021-3-4,별표 5개 만점에 5개를 받았습니다.,0,자산연동 해보니 금융사를 한번에 확인할수 있어 편리합니다.
2296,2019-8-1,별표 5개 만점에 1개를 받았습니다.,6,처음에 모르고 프로모션코드 입력 안하고 넘어가서 나중에 등록하려고 보니 안 됨. 탈퇴하고 다시 가입해서 추천정보 등록에서 등록하려고 보니 프로모션코드 등록하는 곳은 없고 직원추천등록만 있어서 기회만 날려먹음. 솔직히 이 목적 아니면 평생 쓸 일 없는 어플이라 탈퇴하고 바로 삭제함. 첫 혜택 받은 적이 없으면 가입 후에도 따로 등록할 수 있게 수정이 필요할 듯.
2297,2018-11-14,별표 5개 만점에 1개를 받았습니다.,0,이거 어떻게 종료 하는건가요? 아무리 뒤로가기 눌러도 종료가 안되서 강제종료 하고 있네요 업뎃 전엔 문제 없었는데 업뎃 후에 무슨 짓을 한건지 모르겠네요
2298,2021-3-12,별표 5개 만점에 3개를 받았습니다.,0,자산연동 이벤트 때문에 댓글 남김 유사 앱과 다르게 퇴직연금도 나오는건 흥미로우나 사이다뱅크랑 케뱅 플러스박스 잔액은 안나오는데 왜 그런건지.. kb은행에서 오픈뱅크하면 나오는거 봐서는 기술문제는 아닌것같은디
2299,2020-7-22,별표 5개 만점에 5개를 받았습니다.,1,자주 사용하고 있어요. 이벤트도 다양하게 있고 포인트리 적립을 쉽게 볼 수 있어 좋아요. 다만 아쉬운점은 접속자 많을 때 오래 기다리게 돼서 그것만 개선 되면 더 좋을 거 같네요.
2300,2019-7-13,별표 5개 만점에 3개를 받았습니다.,0,앱은 좋은것 같아서 설치했는데 인증번호가 안옵니다.. 왜 이러는지 생년월일도 맞고 통신사 확인 다 했는데 본인인증정보를 다시 확인해달라고..안옵니다
2301,2018-10-8,별표 5개 만점에 5개를 받았습니다.,0,이벤트가 풍성하고 사용하기도 쉽네요. kb계열 다른 앱들은 가끔씩 연결이 안된다는 메시지를 뿜던데 리브메이트는 그런 경우가 거의 없네요.
2302,2018-9-28,별표 5개 만점에 5개를 받았습니다.,0,리브메이트를 사용하면 할수록 포인트도 모을수있고 쇼핑도 저렴하게 할수도 있고 너무 좋은거 같아요~ 앞으로 계속 이용하게 될거 같아요~
2303,2020-4-13,별표 5개 만점에 5개를 받았습니다.,0,리브메이트 앱 너무 좋아요 kb카드를 메인으로 쓰는 사람에게 혜택도 많고 매일퀴즈 상식퀴즈 데이터 실험실증 포인트리 모을수 있는 기회가 많아서 좋아요 타임쿠폰으로 저렴하게 쿠폰 살 수 있는 재미도 완전 쏠쏠합니다 리브메이트 무조건 하세요!!!
2304,2020-8-20,별표 5개 만점에 4개를 받았습니다.,1,"리브메이트 사용한지 얼마 안되었는데요. 앱에 동그라미빨간숫자1이 왜 안사라질까요? 보통 새로운 메세지가 뜨면 숫자가 뜨잖아요? 앱을 지우고 새로 깔아도, 업데이트를 해도, 앱 안에 기능들을 다 눌러 보았는데.. 안사라지네요.. 에러? 이 숫자가 뭘까요? 2020.8.20 로딩이 길어욧. 본인인증도 8월초 했었는디요. 그때도 삭제후 다시까니 되더니.. 기다리다 앱 삭제후 다시깔구 본인인증 후 로그인 하니 열리네요ㅡ.ㅡ"
2305,2018-9-14,별표 5개 만점에 4개를 받았습니다.,1,"처음엔 포인트리 관리용으로 사용하다가, 오늘의퀴즈 라던가 이벤트를 해서 포인트모으는게 재밌더라구요ㅋㅋ 제일좋은건 포인트리를 관리할 수 있다는게 제일 좋구요! 가끔씩 오류가 나는것만 고치면 될것같습니다^^"
2306,2021-3-19,별표 5개 만점에 5개를 받았습니다.,0,국민 어플은 넘 많지만.. 쿠폰함이랑 페이 쓸수있어서 편해요
2307,2020-5-16,별표 5개 만점에 4개를 받았습니다.,0,솔직히 다 좋은데요 포인트리가 계속 줄어요 아니무슨 제가 포인트리쇼핑몰?에서 뭘 산 것도 아닌데 왜 줄죠?처음엔 19090포인트린가 요정도 있었는데 지금은 11884포인트리네요 이게 어떻게 된거죠?
2308,2020-4-15,별표 5개 만점에 5개를 받았습니다.,0,앱 간편하고 구성이 좋어요. 바코드결제로 포인트리까지 쉽게 복합결제 가능한 점 너무 좋습니다. 사용가능 지점이 많아지면 좋겠습니다^^
2309,2021-3-17,별표 5개 만점에 5개를 받았습니다.,0,이벤트하는거 유익해요.좀더 많은 이벤트 해주시면 좋겠어요^^
2310,2020-4-15,별표 5개 만점에 5개를 받았습니다.,0,수수료없이 간편하게 송금할 수 있고 다양한 이벤트 참여를 통해 포인트리도 모을수있어서 좋아요! 앞으로도 다양한 이벤트 많이 기대할게요^^
2311,2021-3-25,별표 5개 만점에 5개를 받았습니다.,0,정말편해요 ㅎㅎ
2312,2018-11-13,별표 5개 만점에 5개를 받았습니다.,0,항상 국만카드 포인트로 편의점에서 결재할때 쓰고있습니다. 상시10프로 적립 너무 좋네요. 앞으로도 계속 이어나가길 바랄께요~
2313,2018-9-30,별표 5개 만점에 5개를 받았습니다.,0,kb포인트 다양하게 활용할 수 있어 좋아하는 앱입니다. 다만 서버가 조금 불안정한 것 같아요. 사람이 많으면 앱이 자꾸 꺼지네요.
2314,2019-7-1,별표 5개 만점에 1개를 받았습니다.,0,이미 회원가입되어있는데 로그인시도 회원가입하라고 합니다. 가입시도하면 고객정보 복구 실패라고 뜨네요..로그인할수가없어요 왜그러는지ㅜ
2315,2019-12-12,별표 5개 만점에 1개를 받았습니다.,0,회원가입을 아이디와 비번으로 하게 해주세요! 개인사정으로 인해서 가족명의로 핸드폰을 쓰는 사람이 많은데 핸드폰 번호 수정도 안되고 다 막아놔서 사용할수가 없네요... 서비스차원에서 만든 앱이라고 하기엔 너무 배려없이 만들어진 것 같습니다!
2316,2020-6-19,별표 5개 만점에 1개를 받았습니다.,0,스토어엔 답글다는데 고객센터 문의하는건 왜 메일이 안오는거죠 벌써 2주일도 지났는데다 요즘 보고쌓기에 올라오는것도 하는것마다 적립안되고 회원가입하는건 인증문자도 안오고 뭐 하나 되는거라곤 없어요..
2317,2018-11-5,별표 5개 만점에 1개를 받았습니다.,0,아니 회원가입이 안되서 못합니다!! 말이 됩니까?? 이거 인증번호 발급 눌렀는데도 10분째 안오네요? 계속 해봐도 안와요.....화가나네요.... 빨리 오게 고쳐주세요....;;
