,DATE,STAR,LIKE,REVIEW
331,2019-9-26,별표 5개 만점에 1개를 받았습니다.,4,별 주기도 아까운 앱이네요. 다음 페이지로 넘어가야 뭘 할텐데 첫 입장 화면부터 먹통이니..
332,2020-3-3,별표 5개 만점에 1개를 받았습니다.,9,19년도엔 보험금청구시 서류를 사진첨부가능했고 그래서 진료비 영수증 다 찍어놓고 폐기했는데 오늘 청구하려고 들어가니 사진첨부기능이 없어지고 촬영만 있네요ㅡㅡ 더 불편해졌어요 귀찮게 PC로 들어가서 해야되는데.어플의 편리성이 없고.. 청구가 편이해서 앱쓰는건데 황당하네요ㅡㅡ
333,2020-6-26,별표 5개 만점에 1개를 받았습니다.,0,엄청 느리고 불편. 최악의 앱. 이 앱 때문에라도 다시는 보험에 가입하고 싶지 않음.
334,2019-5-27,별표 5개 만점에 5개를 받았습니다.,1,앱으로 신청은 아직 안해봤는데 지금까지 보험금 지급은 문제 없었어요 DB실손 아주 잘 사용중입니다.
335,2020-3-28,별표 5개 만점에 1개를 받았습니다.,1,로그인 자체를할수 없게 만들어놓고 무슨 평가를 하라는건지.. 소비자를 열받게하는 보험회사
336,2019-8-20,별표 5개 만점에 1개를 받았습니다.,0,앱이 쓰레기에요. 일부러 이렇게 만든건가요? 열받아서 보험금 청구 못하게 하려고? 욕 나오네요. 잠깐 뭐 보는데도 몇번이 다운이 되는건지.. 쌍욕 나와요!
337,2020-4-6,별표 5개 만점에 1개를 받았습니다.,1,갑자기 실행이 안되고 시작화면만 지속되요. 빠른 수정부탁드려요
338,2018-12-24,별표 5개 만점에 1개를 받았습니다.,4,블록암호화오류 계속 생겨서 내가 가입한 보험 조회도 불가능. 내년에는 다른 보험사 이용해얄 듯.
339,2019-1-9,별표 5개 만점에 1개를 받았습니다.,1,공인인증서로그인시 글자자판이 잘나오지않네요 여러번시도해야 겨우자판이나와서 로그인이되네요
340,2018-12-16,별표 5개 만점에 1개를 받았습니다.,1,생체 인증 안되는 건 언제 고치려는지... 일부러 수정하지 않는 듯 하네요.
341,2019-12-1,별표 5개 만점에 1개를 받았습니다.,3,사진 불러오기해서 바로 올리는게 더 편한데 이 기능이 없어져 별로예요ㅡ
342,2020-4-6,별표 5개 만점에 1개를 받았습니다.,1,"업데이트후 로그인 않됨.보험사공인인증서 인식않되고,은행인증서 인식하더니 재등록 메세지만 뜸"
343,2019-2-27,별표 5개 만점에 1개를 받았습니다.,0,신규가입하고 들어가려는데 느리고 멈춰있네요 삼성다이렉트쓰다 갱신보험료 동부가 조금 저렴해서 가입했는데 영 불편하네요
344,2020-4-1,별표 5개 만점에 3개를 받았습니다.,1,뒤로가기하면 앱종료 뜨는데 한번 뒤로가기 기능이 좀 잇엇으면 좋겟네요
345,2019-3-13,별표 5개 만점에 1개를 받았습니다.,0,로그인이 안되요! 인증서 생체인증 둘다 해봐도 로그인이 되질 않네요... 배부르셨나... 이래서 가입하겠습니까?
346,2020-4-6,별표 5개 만점에 1개를 받았습니다.,2,촬영이 안되는데 서류 접수를 어떻게 하나요? 사진 불러오기 기능도 없고 불편하네요.
347,2020-4-7,별표 5개 만점에 1개를 받았습니다.,1,별 1개도 아깝다 업데이트 하라고 이동하기 버튼만 나오고 정작 업데이트 버전도 안올라옴
348,2018-10-15,별표 5개 만점에 1개를 받았습니다.,0,오늘부터 위변조 검증 오류 어쩌구 뜨면서 실행 안되는데...이거 뭔가요?
349,2020-4-6,별표 5개 만점에 1개를 받았습니다.,2,청구하려는데 사진촬영이 안되요 로그아웃해보고 지웠다깔아보고‥카메라 고장난줄알았네‥
350,2019-8-16,별표 5개 만점에 1개를 받았습니다.,0,백신구동단계에서 멈춰서 어플동작이 되질않습니다. 청구를 할수가없습니다. 확인부탁드립니다
351,2020-4-8,별표 5개 만점에 1개를 받았습니다.,2,업데이트했더니 주민번호 형식이 잘못됐다고 보험금 청구가 안되네요ㅡㅡ
352,2019-10-1,별표 5개 만점에 1개를 받았습니다.,3,진짜 그지같네.. 보험청구하지말고 보험료만 닥치고 내라는건지... 왜 들어가지도 않는걸 안고치냐고........... 아 개빡치네
353,2020-1-31,별표 5개 만점에 1개를 받았습니다.,1,도데체 거리 사진찍는거 어딨는거여?아무리찾아도없고 찾기쉽게 찾기기능을 놔두던가 뺀거여뭐여
354,2020-6-29,별표 5개 만점에 1개를 받았습니다.,0,구비서류 사진을 촬영하는 방법밖에 없습니다.. 다른데는 업로드 하는 방법도 있는데..
355,2020-4-7,별표 5개 만점에 1개를 받았습니다.,0,업데이트 해야한다그래서 들어가면 업데이트가 없어. 지웟다 다시 깔아도 업데이트하래 어플 들어가지도 못해 장난하냐
356,2020-4-7,별표 5개 만점에 1개를 받았습니다.,1,로그인 눌러도 반응도 없고 업데이트도 없는데 업데이트 해야된다고 하고 최악 별 1개도 아까워
357,2020-8-21,별표 5개 만점에 1개를 받았습니다.,0,설치 실행하니 위변조 앱가능성 있다며 중지되고 튀어 나옵니다 실행도 못해봣네요
358,2019-7-1,별표 5개 만점에 1개를 받았습니다.,4,업데이트하고 불편해짐 사진불러오기가없어 서류 미리찍어 놓아도 잃어버림 청구가 어려움
359,2020-8-14,별표 5개 만점에 1개를 받았습니다.,1,앱을 설치해두 화면이 계속 검게 나오고 몇번을 제거했다가 다시 설치하기해두 까만화면만 나오네요 ㅜ
360,2019-6-24,별표 5개 만점에 2개를 받았습니다.,1,갑자기 실행이 안되고 열자마자 자동 종료되요.왜이러는걸까요
361,2020-5-22,별표 5개 만점에 1개를 받았습니다.,1,제대로 안되서 어플로 못하고 항상 홈페이지 들어가서 합니다. 매우 불편.
362,2020-9-16,별표 5개 만점에 1개를 받았습니다.,1,위변조된 앱일 수 있습니다.종료합니다. 이러고나서 종료만 계속됩니다. 너무 불편하네요
363,2020-4-6,별표 5개 만점에 1개를 받았습니다.,1,보험금 청구도 안되고. 사진촬영도 안되고. 도데체 뭘 업데이트 했다는건지
364,2020-5-30,별표 5개 만점에 1개를 받았습니다.,0,어플로 보험금청구 접수해도 며칠씩 처리도 안하고 방치해둘거면 뭐하러 어플 만들어서 쓰라고 하는거요
365,2020-5-13,별표 5개 만점에 1개를 받았습니다.,1,서류 어떻게 등록하라는겁니까? 좋은 문서 촬영앱 천지인데 직접 찍는것도 짜증나는구만 이젠 등록도 안되네요?
366,2019-7-3,별표 5개 만점에 1개를 받았습니다.,1,질병땜에 치료받고 서류제출하려고 10장넘게 찍고 제출하기 눌렀는데 자꾸 초기화되요 3번 이러니까 진짜 앱만든새끼 죽여버리고 싶네요. 없던 암이 걸릴거같습니다. 암 치료비 청구해야겠네요. 제발 계약종료 해주세요 쓰레기같은 앱 쳐다보기도 싫어요ㅠㅠ
367,2020-8-27,별표 5개 만점에 1개를 받았습니다.,1,보험서류 미리 사진 다 찍어놨는데 바로 첨부하는 기능이없고 바로 촬영해서 첨부라 개짜증
368,2020-5-7,별표 5개 만점에 1개를 받았습니다.,1,예전꺼보다 너무 불편해요. 보상청구에 사진가져오기 기능도 넣어주세요.
369,2020-4-6,별표 5개 만점에 1개를 받았습니다.,1,리뷰첨써보게하는앱 최신버전인데 자꾸 업데이트하라고 뜨면서 아무것도 못하게.. 어쩌라는건가요
370,2018-10-15,별표 5개 만점에 2개를 받았습니다.,0,너무 느리고 계속 위변조검사 실패라 뜨더니 이제는 접속도 안되요.
371,2020-4-7,별표 5개 만점에 1개를 받았습니다.,1,업데이트하라고 해서 하고 앱접속하니깐 왜 계속 업뎃하라고 마켓으로 보냅니까? 지웠다깔아도 똑같고ㅡㅡ 관리좀하세요
372,2020-4-7,별표 5개 만점에 1개를 받았습니다.,1,업데이트 되어있는데 왜자꾸 업데이트 해야한다고 뜨냐구요... 로그인도안되고 빨리 개선해주세요
373,2019-11-12,별표 5개 만점에 1개를 받았습니다.,1,별 하나도 아까움. 보험 청구 할려고 하니깐 사진을 무슨 이따구로 찍게 만들어놨냐? 지들 직원 몇명 편하자고 고객을 불편하게 만드네.. 23장 정도 되는거 겨우 찍어 보낼려고 하니깐 뭐? 10분 지났다고 자동 로그아웃? 에라이! 괜히 db로 갈아탔다 다시 해지하고 딴데 갈련다
374,2020-9-14,별표 5개 만점에 1개를 받았습니다.,1,약관동의 선택사항도 필수로 만들어서 무조건 광고 등 수신하게 만든 쓰레기 어플
375,2020-6-20,별표 5개 만점에 1개를 받았습니다.,0,보험회사 중 어플은 단연 최고로구나~~!! 고객을 포기하게 만드는 방법으로는 최고!!!
376,2019-7-9,별표 5개 만점에 1개를 받았습니다.,0,계속 로그인이 자동적으로 튕겨서요.ㅡㅡ 보험금청구 참 번거롭네요.
377,2020-4-13,별표 5개 만점에 4개를 받았습니다.,1,"보험청구 및 추가청구, 보상내역 조회가능 ㅡ 자녀 보상조회는 안됨ㅠ"
378,2020-9-25,별표 5개 만점에 1개를 받았습니다.,1,잘되다가 저번달부터 위조된 앱이라고 뜹니다 보험료납부할라고 했는데..
379,2020-4-10,별표 5개 만점에 1개를 받았습니다.,1,아니 뭔 어플을 어떻게 건드렸길래 되는게 없노 이때까지는 느려도 쓸수는있었는데 이건 느리기도느리고 되는건없고
380,2020-9-15,별표 5개 만점에 1개를 받았습니다.,1,공인인증서 최초1번만 등록하라해놓고 아니 씨댕 할때마다 등록안되어있대...아진짜짜증 뭐 이따구로 만듬?
381,2020-4-12,별표 5개 만점에 1개를 받았습니다.,1,이거 청구하라고 만든거 맞음? 인증을 수십번해도 다음단계를 안넘어가는데 인증하다 곡터져죽겠다 ㅡㅡ;
382,2020-8-18,별표 5개 만점에 1개를 받았습니다.,1,사진 찍어놓은걸 업로드 하도록해놔야지 누가 서류들고다니면서 직접 찍어서 올리나? 청구하기 쉽게 만들어야지 제정신이 아닌듯
383,2020-3-9,별표 5개 만점에 1개를 받았습니다.,3,로그인부터 안되는데 무슨평가? 에러코드0 블록암호화요청 실패로 로그인 못한지 일년이 넘음 쓰레기보험사다운 쓰레기앱
384,2020-4-6,별표 5개 만점에 1개를 받았습니다.,1,회원가입이 안되요 공인인증서랑 문자로 본인확인하는거 안눌러짐ㅡ.ㅡ
385,2019-3-12,별표 5개 만점에 3개를 받았습니다.,0,메뉴는 잘 구성 되어 있으나 속도가 매우 느림. 개선 필요
386,2020-4-6,별표 5개 만점에 3개를 받았습니다.,0,앱 보상청구시 카메라실행이 안되네요 업데이트 후 증상입니다 수정해주세요
387,2018-10-10,별표 5개 만점에 2개를 받았습니다.,1,공인인증서 로그인 암호 오류로 떠서 번거롭고 짜증남.
388,2020-4-7,별표 5개 만점에 1개를 받았습니다.,1,보상받으려 영수증 찍으려하면 카메라기능 먹통되고 튕깁니다.
389,2020-4-6,별표 5개 만점에 1개를 받았습니다.,2,정말 제대로 시행이 되는날이 잘없습니다 답답하네요 관리를 안하나봅니다
390,2019-6-26,별표 5개 만점에 1개를 받았습니다.,3,보험금청규할때 갤러리불러오기가 안나와요 ㅡㅡ 촬영하기만나와서 짜증나네요 예전께 그나마 잘됫던거같은데 ㅠㅠ
391,2018-11-29,별표 5개 만점에 1개를 받았습니다.,4,ㅋㅋ보험금청구하려다화나서안하게만드는게 목적인가? 서류만찍으려하면 앱꺼짐...
392,2020-4-6,별표 5개 만점에 1개를 받았습니다.,1,소프트웨어 업데이트하고 검증이 제대로 안된거 같습니다 보험금 청구가 안되요
393,2020-10-10,별표 5개 만점에 2개를 받았습니다.,2,보험금청구하려고 보는데 본인 피보험자 누르라는데 누르는것도 안되네요.. 앱을 만들다가 만건지...
394,2020-8-6,별표 5개 만점에 1개를 받았습니다.,1,찍어놓은 사진으로 올릴 수 있었으면 좋겠네요. 어플 내의 카메라로 찍어야 하니까 불편해요.
395,2018-12-19,별표 5개 만점에 5개를 받았습니다.,1,보험사들 어플중 제일보기 편하고 손쉽게 찾을수있어서 좋아요
396,2020-4-8,별표 5개 만점에 1개를 받았습니다.,1,개같은 어플 인증하면 서비스 오류라고 뜨고 pc에서 하려하면 어플로만 진행된다 하고
397,2019-9-20,별표 5개 만점에 1개를 받았습니다.,4,설치후 권한동의하고 안내문구화면에서 넘어가지않고 멈춤
398,2020-5-21,별표 5개 만점에 1개를 받았습니다.,0,보험료지불은 인증으로 지연시키고 참 어이없네 .이벤트도 그냥하지를말든가 9개모아논거 3개짜리 응모하니깐 9개를그냥 쳐드시고 다음부터 안햇갈리게 하겠단다. 짜증나서 지우고 실손도 옮기던지 해야지
399,2018-12-24,별표 5개 만점에 1개를 받았습니다.,4,접속부터가 안 되는데.. 뭐라도 확인하고 싶어도 확인 할 수가 없게 되어 있네요.
400,2019-3-14,별표 5개 만점에 1개를 받았습니다.,0,쓰레기앱 뭔 요구사항만 많고 접속드럽게 안되네 광고에 수십억쓰지말고 앱이나 좀 신경쓰시길
401,2020-5-28,별표 5개 만점에 1개를 받았습니다.,1,웃기지도 않네. 서류는 사진 촬영만 가능하고. 사진이 있을거라는 생각은 전혀 안하는 회사.
402,2020-4-5,별표 5개 만점에 1개를 받았습니다.,0,왜자꾸 링크가 안걸리죠? 프로그램 오류인줄알고 삭제하고 다시설치해도 마찬가지네요ㅜㅜ
403,2020-6-19,별표 5개 만점에 1개를 받았습니다.,0,대체 이런걸 왜 만든거요??? 가입자들 약올려서 계약해지 하게 만든거라면 인정!!! 로그인 한번 할려다 명 짧은놈은 늙어 죽것소!!!!
404,2020-4-7,별표 5개 만점에 1개를 받았습니다.,0,앱을 열었는데 업데이트가 필요하다하여 창으로 이동하라는데 업데이트 창이 떠야 할것아닙니까? 도대체 무슨 기준입니까 홈페이지 드가서해도 로그인이 안되네요
405,2020-4-6,별표 5개 만점에 3개를 받았습니다.,1,사진찍는게 검정화면으로 나와요.서류제출 빨리수정 해주세요
406,2019-7-3,별표 5개 만점에 1개를 받았습니다.,0,찍어놓은사진 첨부 왜 안되나요? 아 청구 못하게하는건가 빡치네
407,2020-5-31,별표 5개 만점에 5개를 받았습니다.,1,사진만 수동으로 찍으면 괜찮아요. 자동찍기하면 허파 디비짐
408,2019-7-3,별표 5개 만점에 1개를 받았습니다.,4,일부러 청구하지 못하게 포기하게 만든 앱인가 청구자체가 안되는데 무한 로딩 안넘어가는데 어떡게 하란거죠?
409,2019-7-3,별표 5개 만점에 1개를 받았습니다.,4,앱사용 10년 만에 처음 리뷰씁니다. 일부러 보험금 청구 못하게 하려고 만든 앱 같습니다.
410,2020-4-6,별표 5개 만점에 2개를 받았습니다.,1,하라는대로했는데 로그인은 왜 안되고 계속 업데이트한다고 뜨고 왜이러는지요
411,2020-4-6,별표 5개 만점에 1개를 받았습니다.,1,왜자꾸 로그인하는데 업데이트하라고하고 화면가보면업데이트는없고 무슨일인가요?
412,2018-11-28,별표 5개 만점에 2개를 받았습니다.,1,로딩이 너무 안되고 너무 느려요 하다가 멈추고 그러네요
413,2019-10-8,별표 5개 만점에 1개를 받았습니다.,0,설치후 이벤트 화면에서 먹통되네요.제대로 시험좀하고 릴리스 합시다.
414,2019-9-30,별표 5개 만점에 1개를 받았습니다.,0,진짜 인간적으로 너무 너어무 너어어어어무 느려요 몇 번째 껐다 키는지 모르겠어요
415,2020-5-26,별표 5개 만점에 1개를 받았습니다.,1,보험구청구 메뉴가 아예 접속이 안되네요 언제 수정되나요?
416,2019-7-5,별표 5개 만점에 1개를 받았습니다.,2,아니 청구하지말라는건가 앱은 개같이 만들어놓고 이게 뭐하는거야 돈만 받아먹으면 끝이냐진짜 올리기 뭣같이 만들어놨네 이거 만든 놈 잘라라
417,2019-10-8,별표 5개 만점에 1개를 받았습니다.,1,팝업창 닫기도 안되고 바로가기도 안되고 앱을 발로만들었냐
418,2020-4-7,별표 5개 만점에 1개를 받았습니다.,0,"업데이트를 했는데도 계속 업데이트하라고 나오는데,, 앱사용자체가안되네여"
419,2020-6-17,별표 5개 만점에 1개를 받았습니다.,0,정말 보험금청구하기힘드네요 타 보험회사들과 비교가안될만큼 최악의앱입니다
420,2020-12-9,별표 5개 만점에 1개를 받았습니다.,1,별 하나도 아깝다 폰을 부셔버릴려고 했네요 ㅠ
421,2020-5-25,별표 5개 만점에 2개를 받았습니다.,1,ERR_EMPTY_RESPONSE 오류코드 공인인증서 로그인후 -보상청구를 누르면 연결이 안됩니다.
422,2019-8-8,별표 5개 만점에 1개를 받았습니다.,0,오류가 너무나도 심하네요 사진 짝어서 올라야 겠네요
423,2020-4-8,별표 5개 만점에 1개를 받았습니다.,2,장난치나 보험청구하는데 로그인은 되는데 피보험자가 존재하지않아? 유령이냐? ㅋㅋㅋ 어이없네 청구 못하게 할라고 그러냐? ㅋ
424,2019-9-1,별표 5개 만점에 2개를 받았습니다.,0,뭐든 누르면 5초 정도 있다가 반응함. 앱 때문에 내년엔 삼성화재로 돌아갈 생각
425,2020-1-23,별표 5개 만점에 1개를 받았습니다.,1,로그인 공인인증서 등록하라고 해서 하는데 등록이 안 되고 정말 엉터리 입니다
426,2018-12-26,별표 5개 만점에 1개를 받았습니다.,2,화면이 하얗게만 뜨고 접속이 안되는데 어쩌라는거 ㅡ ㅡ
427,2020-4-7,별표 5개 만점에 1개를 받았습니다.,0,업데이트 하라해서 확인하면 실행이 되야 되는것 아닌가요? 실행되지도 않는데 무슨 업데이트를 하라는건지...
428,2020-4-5,별표 5개 만점에 1개를 받았습니다.,1,업데이트하고 켜도 not found 문구가 뜨는건 도대체 얼마나 관리를 안하는겁니까..
429,2019-10-16,별표 5개 만점에 5개를 받았습니다.,3,좋네요ㅎㅎ 보험과 관련해서 일일히 전화안해도되서 편리해요
430,2019-11-5,별표 5개 만점에 1개를 받았습니다.,3,사진 불러오기 기능이 왜 안되는지 너무 불편하네요
431,2021-2-3,별표 5개 만점에 1개를 받았습니다.,0,와~~~~~ 징허네진짜 관리안합니까? 다음페이지로 넘어가질않네 애들꺼 보장내용 좀 볼라했드만 속 터지게 만드네 내일 바로 해지할란다 현대해상으로 갈아탄다 짜증이빠이다
432,2020-5-7,별표 5개 만점에 1개를 받았습니다.,1,뭔 쓰레기같이 업뎃을 했냐 원래는 찍어놓은 사진 업로드 가능했었는데 왜 바로 찍게 바꾼 거지? 뭔 생각인지 모르겠네
433,2020-4-7,별표 5개 만점에 1개를 받았습니다.,1,계속 업데이트 하라고 나오고 실행이 안되요 다시 깔아도 맞찮가지예요
434,2020-4-7,별표 5개 만점에 3개를 받았습니다.,2,보험청구시 사진 불러오기 기능 부탁드립니다.
435,2019-6-28,별표 5개 만점에 1개를 받았습니다.,3,미리 찍은 사진을 관련서류로 제출하는데 불편함. 그런 기능이 없어짐?
436,2019-7-3,별표 5개 만점에 1개를 받았습니다.,1,업데이트하고 사진불러오기도 없어지고 서류제출이 안된다 최악
437,2020-4-5,별표 5개 만점에 1개를 받았습니다.,0,구동이 아예 안되는데요? 페이지를 찾을수가 없데요.
438,2020-4-11,별표 5개 만점에 1개를 받았습니다.,1,업데이트 후 보험금 사진 전송하기가 안되네요 일부러 막은건 아니죠? 최악이네요
439,2020-4-6,별표 5개 만점에 1개를 받았습니다.,1,짜증나네 영수증 첨부하려 사진촬영누르면 왜 다시 처음화면으로 가는 건가요???
440,2020-5-24,별표 5개 만점에 1개를 받았습니다.,0,최고네요 느려터져가지고 로딩 죙일하고 해약하고 꺼지라는거임?
441,2019-10-4,별표 5개 만점에 1개를 받았습니다.,0,9004오류가뭔가요? 이거때문에 앱 실행도 안되는데 .... 빠른해결부탁드립니다
442,2018-12-17,별표 5개 만점에 1개를 받았습니다.,1,왜 사진 전송하려니 통신오류라고 뜨나요? 해결방법은???
443,2020-10-7,별표 5개 만점에 1개를 받았습니다.,3,로그인이 안되요 에러라고 나오고 이거뭐 공지라도 해주시던가해야죠
444,2018-10-19,별표 5개 만점에 5개를 받았습니다.,6,편리하고 쉽게 메뉴가 되어 있어 좋음
445,2020-4-6,별표 5개 만점에 5개를 받았습니다.,1,다른 보험어플들은 작성과 보내는과정이 더많아요.그런데 여기는진짜간편해서 넘편하고 좋아요
446,2019-3-3,별표 5개 만점에 1개를 받았습니다.,0,머 자꾸 공증인증서 비밀번호만 치라는데 ㅡㅡ 5번치다 삭제하네요 사용을 못하겟네요 어휴 사용을할수가 읍는사이트 ㅡㅡ 고객센터 전화해야지
447,2019-10-8,별표 5개 만점에 1개를 받았습니다.,2,자꾸 위변조 앱이라고 뜹니다...일주일넘게 지웟다 깔았다를 얼마나 반복중인지...
448,2019-12-8,별표 5개 만점에 2개를 받았습니다.,2,어제 보험청구는 했는데 오늘은 로그인 오류라고 하면서 안됩니다. 오늘 페이지장애인가요?
449,2019-6-29,별표 5개 만점에 2개를 받았습니다.,0,업데이트 99%서 멈춤. 수없이 해도 안됨.미쳐버림.!
450,2019-1-2,별표 5개 만점에 1개를 받았습니다.,9,사진촬영 다했는데 제출안됨 몇번씩반복하다 짜증남 보험금 청구를 하라는건지 말라는건지
451,2020-9-26,별표 5개 만점에 1개를 받았습니다.,1,어플이 너무 쓰레기같아요... 보험금 주기가 싫은건지 어플이 너무 쓰레기같고 툭하면 꺼지고 진짜 최악입니다.
452,2020-4-5,별표 5개 만점에 1개를 받았습니다.,1,메인 화면 자체가 안 뜸.. 어플을 사용할 수가 없음..
453,2019-6-26,별표 5개 만점에 1개를 받았습니다.,2,이거 왜 자꾸 업데이트를하라고만하나요?ㅜㅜ 빨리 오류수정해주세요!
454,2019-6-24,별표 5개 만점에 2개를 받았습니다.,4,앱이 너무 느려서 못쓸정도네요. 그래도 별은 두개 드립니다..
455,2020-3-26,별표 5개 만점에 1개를 받았습니다.,5,앱이 열리지않고 계속 뱅글뱅글 돌아요ㆍ 앱관리자가 없나요? 넘불편합니다
456,2020-4-7,별표 5개 만점에 1개를 받았습니다.,0,업데이트도 안되고 무한 재부팅.. 뭔가요?
457,2020-4-8,별표 5개 만점에 1개를 받았습니다.,1,"카드납부도 안되고, 지금은 아예 어플실행도 안됨"
458,2019-6-11,별표 5개 만점에 1개를 받았습니다.,0,뭐지 이거 초기 무한로딩하다가 앱닫기 나오네...보험비도 많이내는데 이게뭡니까
459,2020-6-25,별표 5개 만점에 1개를 받았습니다.,0,진짜 되는 어플맞아요? 들어가서 확인하려면 최소 10분 왜이래요 이거
460,2019-10-15,별표 5개 만점에 4개를 받았습니다.,3,보험금 청구할 때 편하네요! 확실히 다른 보험사 앱보다 훨씬 나아요
461,2020-10-10,별표 5개 만점에 1개를 받았습니다.,3,모바일로 보상 청구하려고 하는데 피보험자 선택이 안되네요 왜그런거죠?
462,2019-10-6,별표 5개 만점에 1개를 받았습니다.,5,아니 사진첨부 기능 왜 없앴나요? 짜증나네.
463,2018-9-27,별표 5개 만점에 3개를 받았습니다.,1,이거 왤케 느려요? 보험금 한번 신청하려면 인내심이 필요하네요
464,2019-9-30,별표 5개 만점에 1개를 받았습니다.,2,가상호스트어쩌고 하얀화면에서먹통 꺼지지도 않음
465,2018-11-8,별표 5개 만점에 1개를 받았습니다.,2,앱이 실행이 안되고 계속 멈춰요. 빨리 고쳐주세요
466,2018-11-19,별표 5개 만점에 1개를 받았습니다.,0,왜 삼성삼성 하는지 알겠다 뮈설치해라 .뮈인증해라 조낸 복잡하다 열받아서 그냥비싸도 삼성에 가입하련다
467,2019-3-16,별표 5개 만점에 5개를 받았습니다.,1,서비스을이용했는데 친절하게 서비스을받이서 너무나 좋았습니다
468,2020-2-13,별표 5개 만점에 1개를 받았습니다.,0,처음 설치하고 안내화면에서 타치도 안되고 어떻게 앱을 이따구로 만들었는지 이해가 안감
469,2019-9-26,별표 5개 만점에 1개를 받았습니다.,0,설치후 이용자동의하기 문구만 나오고 안됩니다.
470,2019-9-7,별표 5개 만점에 1개를 받았습니다.,0,어플최적화가안되서 열리지도않음 위변조확인중에 응답이없음
471,2020-9-5,별표 5개 만점에 1개를 받았습니다.,0,노트20 에서 실행후 오류뜹니다. 해결해주세요.
472,2019-9-17,별표 5개 만점에 1개를 받았습니다.,7,앱변조라면서 오류뜨구 안들어가지네여 저번달에는 잘 사용했는데여 지우구 깔아두 소용없네여
