,DATE,STAR,LIKE,REVIEW
652,2019-7-1,별표 5개 만점에 5개를 받았습니다.,4,너무 편리하고 처리도 빨라서 좋야요
653,2018-11-24,별표 5개 만점에 1개를 받았습니다.,1,블록 암호화에 실패했습니다. 뭘 해도 안됨
654,2018-12-25,별표 5개 만점에 1개를 받았습니다.,5,전산장애인지 앱실행이안되고 넘불편해요
655,2018-11-29,별표 5개 만점에 1개를 받았습니다.,1,로그인하기가 너무 불편해요
656,2020-4-7,별표 5개 만점에 1개를 받았습니다.,0,설치받고 들어가려고하니 업데이트만 하라그러고 업데이트 활성은 안되네요 뭔가요?
657,2020-4-7,별표 5개 만점에 1개를 받았습니다.,0,업데이트를 계속하라는데 업데이트안떠있고 뭐어쩌란건지 그전이 더남
658,2020-6-4,별표 5개 만점에 1개를 받았습니다.,0,방금 설치했는데 위변조 어쩌구 하면서 실행 안됨
659,2019-3-25,별표 5개 만점에 1개를 받았습니다.,0,진짜 느려터져서 속터집니다
660,2019-11-12,별표 5개 만점에 1개를 받았습니다.,1,저장파일 못올리게해서 왕복 두시간되는 병원을 두번이나 갔다왔음
661,2019-7-17,별표 5개 만점에 1개를 받았습니다.,0,설치가 되야하죠.. 이런글 처음 남겨봅니다.
662,2019-7-18,별표 5개 만점에 5개를 받았습니다.,2,보험금도 신속하게 나오는것 같아요
663,2020-2-18,별표 5개 만점에 1개를 받았습니다.,1,구동시 정지가 되네요
664,2019-1-16,별표 5개 만점에 1개를 받았습니다.,0,이 앱은 왜 제 핸드폰에서 깔리지를 않나요..s7이요
665,2020-4-7,별표 5개 만점에 1개를 받았습니다.,0,아니...업대이트가 없다는데 왜 계속 플레이스토어로 넘기는거에요?? 담당자 월급 밀렸어요?? 왜이렇게 관리가 안돼??
666,2019-8-3,별표 5개 만점에 1개를 받았습니다.,0,로그인도 안되고 반응도 없고 조선족이 만들었니?
667,2020-4-6,별표 5개 만점에 1개를 받았습니다.,0,대기업에서 버그도 못잡고 사진을 찍으려고 하면 창에서 나가버림 ㅡㅡ
668,2019-3-20,별표 5개 만점에 1개를 받았습니다.,0,비회원가입도가능하다해놓고 무조건공인인증 하게 해놓는건 뭡니까?앱관리안하나요?
669,2019-8-27,별표 5개 만점에 1개를 받았습니다.,0,제일기본인로그인이정상적으로안되네요
670,2019-7-4,별표 5개 만점에 1개를 받았습니다.,0,업데이트 이후로 사진 전송이 안됨
671,2019-8-17,별표 5개 만점에 1개를 받았습니다.,0,불러오기 왜안되는데요 짜증나게
672,2019-7-5,별표 5개 만점에 5개를 받았습니다.,0,이용하기 편해요 잘쓸께요
673,2020-4-7,별표 5개 만점에 1개를 받았습니다.,0,아니장난치나업데이트가안되는데 어떻게하라고 계속업데이트해라하고 업데이트는 뜨지도않고 진짜 욕나오게만들어뒀네
674,2020-6-17,별표 5개 만점에 1개를 받았습니다.,0,앱을 왤케못만듬? 개발자들 다 잘라야되는거아님? 프로그래스바하나 제대로못만드네 대기업이
675,2020-5-28,별표 5개 만점에 1개를 받았습니다.,0,도데체 열리긴 열리나여? 무슨 어플이 이따윈지
676,2020-4-6,별표 5개 만점에 1개를 받았습니다.,1,사진찍기 안됩니다--- 언제 업그레이드 되나요??!!!
677,2020-8-27,별표 5개 만점에 1개를 받았습니다.,3,새로깔아도 위변조된 앱이라고 나오면서 구동안됨
678,2020-4-7,별표 5개 만점에 4개를 받았습니다.,0,영수증 사진을 한번에 여러장 올릴수 있으면 별 다섯개
679,2018-10-16,별표 5개 만점에 3개를 받았습니다.,0,스마트폰에서 편리하게 이용가능하면 좋겠어요
680,2019-12-8,별표 5개 만점에 1개를 받았습니다.,0,로그인이 안되잖아요 해결해주세요
681,2020-4-6,별표 5개 만점에 2개를 받았습니다.,0,보상청구하는데 왜? 마지막단계에 서류 촬영이 안되나요?
682,2018-10-31,별표 5개 만점에 1개를 받았습니다.,0,아니 자꾸 나중에 시도하라고 하고 왜 이렇게 느립니까? 앱 관리 안하세요?
683,2020-4-7,별표 5개 만점에 1개를 받았습니다.,0,4일자 업데이트하고 앨범 접근허용했는데도 에러 나네요. 확인해주세요
684,2019-6-26,별표 5개 만점에 3개를 받았습니다.,1,최신버전인데 자꾸 업데이트를 하라고해서 지우고 다시 받았는데도 업데이트를 허라는데 어떻게 해야하나요
685,2019-7-13,별표 5개 만점에 1개를 받았습니다.,0,욕쓰려고 들어왔는데 다른 분들이 많이 써놔서 공감하고갑니다
686,2020-4-7,별표 5개 만점에 1개를 받았습니다.,0,앱 업데이트 했는데도 계속 업데이트 하라고 나옴
687,2019-12-8,별표 5개 만점에 1개를 받았습니다.,0,로그인도 안되게 만들어놨네. .
688,2018-9-19,별표 5개 만점에 1개를 받았습니다.,0,설치도안되는어플을 어케씀
689,2020-9-4,별표 5개 만점에 1개를 받았습니다.,0,위변조된앱일수있습니다 종료합니다 계속뜨네요
690,2019-6-24,별표 5개 만점에 1개를 받았습니다.,0,실행자체가 안되는데...
691,2020-6-23,별표 5개 만점에 1개를 받았습니다.,0,대체 보험금청구어따하라고요ㅋㅋ짜증남
692,2020-7-7,별표 5개 만점에 1개를 받았습니다.,0,버퍼링은 언제 끝나는거임 아니 어플을 만들었으면 관리를 하던가 지금 뭐하자는거여 ㅋㅋㅋㅋㅋㅋㅋㅋㅋㅋ 야마돌게 하노
693,2020-4-10,별표 5개 만점에 5개를 받았습니다.,0,사용하기 편하게 실용적이에요
694,2020-4-5,별표 5개 만점에 1개를 받았습니다.,0,에러 뜨고 화면이 아예 안 열림
695,2018-10-25,별표 5개 만점에 1개를 받았습니다.,0,복잡해서 짜증만나고 시간낭비만 하서 정말 화가남
696,2020-12-5,별표 5개 만점에 1개를 받았습니다.,0,개인정보수정 하는데 하루종일해도 안됨 ㅠ 욕나옴니다 여러분
697,2018-11-28,별표 5개 만점에 1개를 받았습니다.,1,두번째 사진찍으려면 멋대로 닫힘
698,2020-8-13,별표 5개 만점에 5개를 받았습니다.,0,신속한 처리과정이 좋아요
699,2020-4-7,별표 5개 만점에 1개를 받았습니다.,0,업데이트 할게없는데 자꾸 업데이트 화면으로 넘어가라는데요?
700,2020-2-12,별표 5개 만점에 1개를 받았습니다.,1,앱이 계속 다운로드대기중 이란 글만 뜹니다 한시간째입니다.
701,2020-4-13,별표 5개 만점에 1개를 받았습니다.,1,왜 이점수인지는 스스로 잘 알거라고 생각합니다
702,2019-4-27,별표 5개 만점에 1개를 받았습니다.,6,리뷰를 생전 처음으로 남깁니다. 이어플 사용 하면 암걸립니다 그냥 실비청구하러 들어왔다가 암걸려서 암보험까지 청구 할뻔 했네요 왜케 느려요 진짜 갑갑하네
703,2018-10-24,별표 5개 만점에 1개를 받았습니다.,0,생체인식이 안되고 계속 랙에 걸리네요
704,2019-2-9,별표 5개 만점에 1개를 받았습니다.,2,어플이라고 만들어뒀냐 딜레이에 오류에 하.. 졸라 쓰기싫음
705,2019-8-28,별표 5개 만점에 1개를 받았습니다.,0,왜 직접 찍는거 말고 파일첨부는 안되나요?
706,2020-9-1,별표 5개 만점에 1개를 받았습니다.,1,열리지가 않으니 사용도 안 되네요.
707,2019-7-7,별표 5개 만점에 1개를 받았습니다.,2,앱이 작동을 안해요. 청구하지 말라는건지...
708,2020-4-7,별표 5개 만점에 1개를 받았습니다.,0,다운받았는데 왜자꾸 업데이트하라고 하나요? 회원가입도 안되고 업뎃 할것도 없는데 자꾸 없뎃 하라고 뜸
709,2019-3-1,별표 5개 만점에 1개를 받았습니다.,0,다운이되야 쓰던지말던지하지.... 폼으로 스토어에 올려놨냐?동부화재 망해라.... ㅉㅉ
710,2020-4-10,별표 5개 만점에 5개를 받았습니다.,0,실비청구가쉬워졌어요
711,2020-4-10,별표 5개 만점에 1개를 받았습니다.,1,업데이트도 안되고 에휴....쓰레기
712,2020-4-7,별표 5개 만점에 1개를 받았습니다.,0,업데이트했는데 자꾸업데이트하래요ㅡㅡ 짜증남 들어가지지도않음
713,2019-6-27,별표 5개 만점에 1개를 받았습니다.,0,느리다 너무 느리다 쓰레기다
714,2019-10-16,별표 5개 만점에 5개를 받았습니다.,0,사용하기 편하고 좋아용~~~~!
715,2019-9-20,별표 5개 만점에 1개를 받았습니다.,0,앱 설치하고 시작하기전에 동의여부 2-3개 묻다가 계속 먹통.
716,2020-4-6,별표 5개 만점에 3개를 받았습니다.,0,업그레이드가 넘 오래걸리네요
717,2020-4-7,별표 5개 만점에 1개를 받았습니다.,0,업데이트하라며 어서업데이트하라는거야 바빠죽겠는대ㅡㅡ
718,2020-4-5,별표 5개 만점에 1개를 받았습니다.,0,권한 허용다했는데도 열리지 안아요ㅠ
719,2020-5-10,별표 5개 만점에 1개를 받았습니다.,1,업뎃하고나서 개느리고 쓰레기됐네요
720,2019-10-14,별표 5개 만점에 5개를 받았습니다.,1,오 리뉴얼하고 더 깔끔해진거같아여
721,2020-11-27,별표 5개 만점에 1개를 받았습니다.,1,계속 오류남. 짜증
722,2018-12-27,별표 5개 만점에 1개를 받았습니다.,2,어플관리안합니까 요즘같은 세상에 느려터져서 못쓰는 어플이 있다니 ㅋㅋ 쓰레기네
723,2020-7-11,별표 5개 만점에 2개를 받았습니다.,0,여긴 상담원 빼면 다 깐따삐아별임.
724,2019-4-2,별표 5개 만점에 1개를 받았습니다.,0,어플 수준이 참...어플을 쓰면서 이렇게 답답함을 느낀게 처음인거 같네요
725,2020-4-7,별표 5개 만점에 1개를 받았습니다.,0,업데이트 하라고해서 하는데 화면은 자꾸 처음 상태
726,2020-4-6,별표 5개 만점에 1개를 받았습니다.,1,업데이트후 서류 촬영이 안 됨
727,2020-8-28,별표 5개 만점에 1개를 받았습니다.,1,위변조 오류로 이용불가
728,2019-11-10,별표 5개 만점에 1개를 받았습니다.,0,아니 설치했는데 켜지지도않는건 무슨경우야 대체 하..
729,2019-7-1,별표 5개 만점에 5개를 받았습니다.,0,빠르고좋아요..
730,2019-1-8,별표 5개 만점에 1개를 받았습니다.,0,별로 다른 보험사에 비해 떨어짐
731,2020-11-29,별표 5개 만점에 1개를 받았습니다.,0,아나개짜증 설치드럽걱안되네 ㅡㅡ
732,2020-4-7,별표 5개 만점에 1개를 받았습니다.,0,업데이트 이동하라는데 제자리로 돌아오네
733,2020-10-22,별표 5개 만점에 1개를 받았습니다.,0,머꼬? 2시간째 다운도 안되노~~ 보험 취하 해야것네~~ 되지도 않는거 멋하러 만들어놨는지...ㅉㅉ
734,2019-3-22,별표 5개 만점에 1개를 받았습니다.,0,에러뜨면서 작동안됨
735,2019-6-24,별표 5개 만점에 2개를 받았습니다.,0,위변조검증에실패했다는데어떻게들어가죠?
736,2020-10-7,별표 5개 만점에 1개를 받았습니다.,1,확실히 청구를 어렵게 하려고 고의로 이런 게 맞는 것 같아요. 우리 금감원에 민원 넣을까요?
737,2020-4-6,별표 5개 만점에 1개를 받았습니다.,0,사진 촬영이 안됩니다
738,2020-7-15,별표 5개 만점에 1개를 받았습니다.,0,다운이 너무느린데요 12시간 걸리나요
739,2020-4-6,별표 5개 만점에 1개를 받았습니다.,0,업데이트후 사진찍기기능안됨
740,2019-12-6,별표 5개 만점에 1개를 받았습니다.,0,로그인도 안되고 DB손보의 수준
741,2020-4-14,별표 5개 만점에 1개를 받았습니다.,0,그냥 진짜 욕나오네 보험사가 답이없는건지 서비스점검만하나
742,2019-3-1,별표 5개 만점에 1개를 받았습니다.,1,실행이 안되요...
743,2020-5-29,별표 5개 만점에 1개를 받았습니다.,0,초기구동렉 vs 앱 속도 실화냐 이거 ㅡㅡ 쓰지 말란 뜻인가??
744,2020-7-15,별표 5개 만점에 1개를 받았습니다.,0,다운로드안됨 빨리개선해주세요ㆍ
745,2020-4-6,별표 5개 만점에 1개를 받았습니다.,0,사진촬영이 안됩니다
746,2020-4-7,별표 5개 만점에 1개를 받았습니다.,0,업데이트가 실행이 안되네요
747,2018-12-21,별표 5개 만점에 5개를 받았습니다.,0,역시 고객위주로 편리하게 해주는 db손해보험
748,2018-12-24,별표 5개 만점에 1개를 받았습니다.,0,업글안되 삭제했다가 다시깔아도안되
749,2018-9-25,별표 5개 만점에 1개를 받았습니다.,0,핸드폰먹통시키는어플 받지마세요
750,2020-10-10,별표 5개 만점에 1개를 받았습니다.,2,피보험자선택안됨 고치세오
751,2020-7-22,별표 5개 만점에 1개를 받았습니다.,0,설치조차 안 되는데 어떻게 쓰라는 겁니까...
752,2018-12-26,별표 5개 만점에 1개를 받았습니다.,0,휴대폰 인증을 개미쳇바퀴 돌리듯이 하다가 부인하는 이상한 앱
753,2019-10-14,별표 5개 만점에 5개를 받았습니다.,2,편리하게 잘 되어 있네요! 만족스럽습니다!
754,2020-4-7,별표 5개 만점에 1개를 받았습니다.,0,업데이트를했는데 접속하면 계속 업데이트하라는게 뭔말입니까ㅡㅡ
755,2020-4-6,별표 5개 만점에 1개를 받았습니다.,1,보험금청구 사진이계속튕김...업댓이후로안됨. 뭐죠?업댓해서 돈안주겠다는건가...
756,2020-4-7,별표 5개 만점에 1개를 받았습니다.,0,다시 깔아도 업데이트하라는건 뭔지..
757,2020-4-27,별표 5개 만점에 1개를 받았습니다.,0,보험청구가 안되네요? 본인피보험자랑 자녀중 선택하려니 안됨
758,2020-4-7,별표 5개 만점에 1개를 받았습니다.,0,깔자마자 업데이트 하라해놓곤 진행이 왜안됨?
759,2020-4-6,별표 5개 만점에 1개를 받았습니다.,0,로그인 좀 합시다. 쫌....
760,2019-7-17,별표 5개 만점에 1개를 받았습니다.,0,왜안들어가지는거임 왜안되는거임 오늘만그러는거임??
761,2018-12-28,별표 5개 만점에 1개를 받았습니다.,0,보험로그인하면 안되네요
762,2020-9-9,별표 5개 만점에 1개를 받았습니다.,0,위변조된 앱 일수 있습니다 하면서 종료 되니다
763,2019-10-14,별표 5개 만점에 5개를 받았습니다.,0,실 사용하기 유용한 앱인거 같습니다. 잘 사용할게요.
764,2020-10-12,별표 5개 만점에 1개를 받았습니다.,0,엉망진창이구먼 앱도 안깔려 ㅋ
765,2018-10-25,별표 5개 만점에 1개를 받았습니다.,0,앱안됨. 돈못받음 보험계의 악
766,2020-4-17,별표 5개 만점에 1개를 받았습니다.,0,어플 개똥으로 만들지마세요. 어플 개똥으로 만들고 문의하면 '어플로 하시면되요' 이딴 대처하는데 그 누가 사용하고싶겠냐고요 좀 어플 좀 고칩시다 제발;;
767,2019-6-27,별표 5개 만점에 5개를 받았습니다.,0,빠르고 편해요
768,2019-2-21,별표 5개 만점에 1개를 받았습니다.,0,백신구동한다고 나오고 그이후로 흰 화면만 나옴
769,2020-4-6,별표 5개 만점에 1개를 받았습니다.,1,보험청구 사진촬영이 안되요 블랙으로만 떠요
770,2020-4-7,별표 5개 만점에 1개를 받았습니다.,0,왜업데이트하라고 나오는데 업데이트가안되나요 답답해죽겠네요
771,2019-3-5,별표 5개 만점에 3개를 받았습니다.,0,와이파이를끄니 다운로드가되는ᆢ어이없는ㅡㅡ
772,2018-10-26,별표 5개 만점에 1개를 받았습니다.,0,지워버렸음 맘에 안듬
773,2019-12-9,별표 5개 만점에 1개를 받았습니다.,0,로그인오류뜬다계속
774,2018-10-14,별표 5개 만점에 1개를 받았습니다.,0,공인인증서 로그인이 안됨
775,2020-4-7,별표 5개 만점에 1개를 받았습니다.,1,업데이트만 하라고뜨고....드가지질 안네요
776,2021-3-20,별표 5개 만점에 1개를 받았습니다.,0,다운이 되긴 되나요?? 이틀째 대기중인데???!!!!
777,2020-4-6,별표 5개 만점에 1개를 받았습니다.,0,계속 업데이트 하라고 하네요 최신버전인데 ^^;;
778,2020-10-7,별표 5개 만점에 1개를 받았습니다.,2,별점이 낮은 이유가 있네요
779,2019-3-31,별표 5개 만점에 1개를 받았습니다.,0,로그인이 안됨ㅡㅡ구림
780,2020-5-26,별표 5개 만점에 5개를 받았습니다.,1,정말. 진철상당부터 마지막마무리까지 깔끔하네요
781,2020-4-6,별표 5개 만점에 1개를 받았습니다.,1,영수중 사진을 찍을 수가 없네요
782,2019-7-9,별표 5개 만점에 1개를 받았습니다.,0,업데이트하고 망한 케이스
783,2020-1-9,별표 5개 만점에 1개를 받았습니다.,0,위변조된 앱이라고 작동도 안됨.
784,2019-7-12,별표 5개 만점에 3개를 받았습니다.,0,ㅡ 잘 하는 우리 엄마도 너무나도 큰 도움을 그냥 ㅡ
785,2020-8-8,별표 5개 만점에 1개를 받았습니다.,0,"다운로드 자체가 안돼요, 벌써 몇번째 해보는지 모르겠어요."
786,2018-12-21,별표 5개 만점에 2개를 받았습니다.,2,업데이트 시간이 너무 깁니다.
787,2020-4-7,별표 5개 만점에 1개를 받았습니다.,0,왜 지웠다 깔아도 업데이트하라고 난리인거야
788,2020-4-17,별표 5개 만점에 1개를 받았습니다.,1,아 진짜 어플 아름답게도 만들었네 보상 받다가 몸줘 눕겄어
789,2020-8-25,별표 5개 만점에 1개를 받았습니다.,0,위변조된 앱일수 있다고 실행 안됨 ㅡㅡ^ 어쩌라는건지
790,2019-9-16,별표 5개 만점에 2개를 받았습니다.,2,잘되던앱이 왜 안되는지 답답하네요
791,2020-4-6,별표 5개 만점에 1개를 받았습니다.,0,업데이트 후 서류제출 사진활영 안됨
792,2020-4-9,별표 5개 만점에 1개를 받았습니다.,0,계속업데이트만하라고함 누가이따구로앱만듬? 인중쳐맞고싶나
793,2020-4-7,별표 5개 만점에 1개를 받았습니다.,0,업데이트해도 계속 업데이트하라고합니다
794,2020-4-6,별표 5개 만점에 5개를 받았습니다.,0,사용하는데 용이 합니다 :-)
795,2020-4-10,별표 5개 만점에 1개를 받았습니다.,0,사진촬영에서 먹통이되요
796,2018-11-19,별표 5개 만점에 1개를 받았습니다.,0,앱다운이안됨 데이터무제한딘데
797,2020-4-7,별표 5개 만점에 1개를 받았습니다.,0,업데이트 하라는데 플레이스토어에는 업데이트 안떠있네요
798,2019-5-23,별표 5개 만점에 1개를 받았습니다.,1,회원가입조차 안되는앱 ㅡㅡ 관리도 안되는데 머하냐
799,2020-4-7,별표 5개 만점에 1개를 받았습니다.,0,로그인 안됨...뭐를 하라고!?
800,2020-4-7,별표 5개 만점에 1개를 받았습니다.,0,다운로드 받자마자 계속 업데이트 뜨고 로그인도 안돼네요
801,2019-7-24,별표 5개 만점에 1개를 받았습니다.,0,"생체 로그인하면 앱이 먹통이 됨, 쓰레기"
802,2020-4-7,별표 5개 만점에 1개를 받았습니다.,0,업데이트만 자꾸하라네요 뭐어떻게하라는건지 어이없음
803,2020-4-6,별표 5개 만점에 1개를 받았습니다.,0,업그레이드 후 보험 청구 안됨
804,2018-12-28,별표 5개 만점에 1개를 받았습니다.,7,별점1도아깝네요 쓰레기앱 드럽게느리네
805,2020-3-17,별표 5개 만점에 1개를 받았습니다.,0,뭔 앱이 열리지도 않아 거지같이
806,2020-4-6,별표 5개 만점에 1개를 받았습니다.,1,보험금 청구 제출서류 촬영이 안됨 계속 팅김
807,2020-4-7,별표 5개 만점에 1개를 받았습니다.,0,업데이트후 실행자체가 안돼네요
808,2020-1-24,별표 5개 만점에 1개를 받았습니다.,0,앱설치가 너무 안되요ㅠ
809,2020-4-6,별표 5개 만점에 5개를 받았습니다.,0,너무 쓰기 편해요
810,2020-4-6,별표 5개 만점에 1개를 받았습니다.,1,보험금청구시 사진안찍어짐
811,2019-2-25,별표 5개 만점에 1개를 받았습니다.,0,안돼요.....네시간째 안돼요....신랑이 회사망한거아니냐고하네요......ㅠㅠ
812,2020-4-6,별표 5개 만점에 1개를 받았습니다.,0,업데이트후카메라촬영안됨
813,2020-4-6,별표 5개 만점에 1개를 받았습니다.,0,장난치나 업데이트 하라고하고 왜 안데는데!!!!!!
814,2020-8-25,별표 5개 만점에 2개를 받았습니다.,0,왜 위변조 된 앱이라고 뜨고 강제 종료 되는거조?
815,2020-4-6,별표 5개 만점에 1개를 받았습니다.,0,진짜 왠만해서 안남기는데 최악이네요
816,2019-10-4,별표 5개 만점에 1개를 받았습니다.,1,초기단계에서 들어가지질 않네 이거 관리는 하는거요?
817,2021-1-4,별표 5개 만점에 1개를 받았습니다.,0,아니 어플 왜 만듦?되지도 않는거
818,2020-12-2,별표 5개 만점에 1개를 받았습니다.,0,설치가 안되는데요...
819,2020-8-30,별표 5개 만점에 1개를 받았습니다.,1,앱이 켜자마자 꺼지냐
820,2019-2-11,별표 5개 만점에 1개를 받았습니다.,1,설치가 되어야 계약조회를 하지...
821,2020-5-3,별표 5개 만점에 1개를 받았습니다.,0,업데이트 넘불편 합니다
822,2019-1-10,별표 5개 만점에 5개를 받았습니다.,1,편리하고 좋음
823,2019-1-13,별표 5개 만점에 1개를 받았습니다.,0,도대체 가입은 어떻게 합니까? 로그인만 있고....
824,2020-4-7,별표 5개 만점에 1개를 받았습니다.,0,아니 자꾸업데이트하라는데 ㅡㅡ 삭제하고설치해도 안뜨는 업데이트를어디서 하나요
825,2019-8-20,별표 5개 만점에 1개를 받았습니다.,0,보험금 청구하지 말라는건가요 ㅋㅋㅋㅋㅋㅋㅋ 이렇게까지 해야되나요~~??
826,2020-4-7,별표 5개 만점에 1개를 받았습니다.,0,최악 설치가 안되요 ㅜ.ㅜ
827,2020-4-6,별표 5개 만점에 1개를 받았습니다.,0,업데이트 했는데 업데이트 하라는건 뭔가요
828,2019-7-3,별표 5개 만점에 1개를 받았습니다.,0,광고 애자같이 찍더니 어플도 애자같이 만드네 원숭이한테 만들라고 시켰나 진짜 뭐같네
829,2019-9-21,별표 5개 만점에 1개를 받았습니다.,0,로그인이 안됩니다
830,2020-4-7,별표 5개 만점에 3개를 받았습니다.,0,계속 업데이트 하라는데 도대체 어떻게 실행하나요??
831,2020-4-7,별표 5개 만점에 1개를 받았습니다.,0,업데이트 다햇는데 왜자꾸 하라는거예요? 아놔
832,2018-12-18,별표 5개 만점에 1개를 받았습니다.,4,로그인이 안돼잖아요.. 앱좀 제대로만들어요
833,2020-4-7,별표 5개 만점에 3개를 받았습니다.,0,로그인이 안되네요
834,2019-9-23,별표 5개 만점에 3개를 받았습니다.,0,어제저녁부터 접수가 안 돼요
835,2020-4-7,별표 5개 만점에 1개를 받았습니다.,0,업데이트안되서 사용 안됨 에러
836,2019-6-27,별표 5개 만점에 3개를 받았습니다.,0,업데이트가 잘 안돼네요...
837,2020-4-6,별표 5개 만점에 1개를 받았습니다.,0,업데이트하고 사진찍기 눌리면 처음로 감
838,2019-1-28,별표 5개 만점에 1개를 받았습니다.,0,너무 느려요~~
839,2019-1-10,별표 5개 만점에 1개를 받았습니다.,5,이 회사에 가입한 보험을 전부 해약하고 싶다.
840,2020-5-15,별표 5개 만점에 1개를 받았습니다.,0,지금 이 앱만 설치 안 되는데 왜 그러나요..?
841,2019-1-18,별표 5개 만점에 5개를 받았습니다.,5,좋은보험이네요
842,2020-4-8,별표 5개 만점에 1개를 받았습니다.,0,하루죙일 다운로드 대기중이네 와 겁나 빡치려하넹
843,2020-2-17,별표 5개 만점에 1개를 받았습니다.,0,별 하나도 아깝네 앱 진짜 뭐 같네
844,2020-4-6,별표 5개 만점에 1개를 받았습니다.,0,업데이트되고 더 그지같아졌음
845,2019-1-16,별표 5개 만점에 5개를 받았습니다.,6,편해서 너무좋아요
846,2018-9-28,별표 5개 만점에 1개를 받았습니다.,2,아 짜증나네 언제 고칠래.?
847,2019-6-11,별표 5개 만점에 1개를 받았습니다.,0,로그인시 멈춤..
848,2020-4-7,별표 5개 만점에 1개를 받았습니다.,0,업데이트가안되자너ㅡㅡ
849,2018-10-18,별표 5개 만점에 4개를 받았습니다.,1,유용하게잘쓸게요
850,2018-9-20,별표 5개 만점에 1개를 받았습니다.,1,느려서 삭제한다 어플 제대로 만들어린
851,2020-4-6,별표 5개 만점에 3개를 받았습니다.,0,잘사용이안되네요
852,2019-9-16,별표 5개 만점에 1개를 받았습니다.,0,변조됐다고실행이 안돼 뭐야
853,2019-12-4,별표 5개 만점에 5개를 받았습니다.,2,안내원의 설명 매우 만족
854,2020-10-10,별표 5개 만점에 3개를 받았습니다.,0,보상신청이안되요..
855,2020-8-20,별표 5개 만점에 1개를 받았습니다.,0,아니 공식앱 플레이스토어서 받은건데 지가 지를 위변조된 앱이라구 종료한다네 골쌔림
856,2020-4-7,별표 5개 만점에 1개를 받았습니다.,0,업데이트하라면서 다람쥐 챗바퀴 돌게하네요
857,2018-10-22,별표 5개 만점에 1개를 받았습니다.,0,앱 다운받고 실행이 안됨 최악의 앱임
858,2020-4-6,별표 5개 만점에 1개를 받았습니다.,0,업데이트가 안되는데 뭘 자꾸 업데이트 하라는거야
859,2020-4-7,별표 5개 만점에 1개를 받았습니다.,0,안깔리고 업데이트 안됨
860,2020-4-15,별표 5개 만점에 4개를 받았습니다.,1,편리하고좋아요
861,2020-7-4,별표 5개 만점에 1개를 받았습니다.,0,느려터졌네..답답해. 해지다.
